Date,Comment,Like,Dislike,Clean_comment,Comment_Lower,Summary_Tokenized,Comment_no_stopwords,Comments_stem,Sentiment score,Sentiment category
"Mar 04, 2018",ITS SO ODD TO ME THAT SOME PEOPLE HAVE NO KNOWLEDGE OF THIS WEBTOON AND THE FEELS IT HOLDS. HOLD ON TO YOUR HATS KIDDIES. WE GOIN ON A RIDE.,123,10,ITS SO ODD TO ME THAT SOME PEOPLE HAVE NO KNOWLEDGE OF THIS WEBTOON AND THE FEELS IT HOLDS HOLD ON TO YOUR HATS KIDDIES WE GOIN ON A RIDE,its so odd to me that some people have no knowledge of this webtoon and the feels it holds hold on to your hats kiddies we goin on a ride,"['its', 'so', 'odd', 'to', 'me', 'that', 'some', 'people', 'have', 'no', 'knowledge', 'of', 'this', 'webtoon', 'and', 'the', 'feels', 'it', 'holds', 'hold', 'on', 'to', 'your', 'hats', 'kiddies', 'we', 'goin', 'on', 'a', 'ride']",odd people knowledge webtoon feels holds hold hats kiddies goin ride,odd people knowledge webtoon feels holds hold hats kiddies goin rid,-0.3182,neg
"Mar 04, 2018",NOOO I NEED TO PROTECT MY PERSEPHONE 😭😭😭,109,1,NOOO I NEED TO PROTECT MY PERSEPHONE ,nooo i need to protect my persephone ,"['nooo', 'i', 'need', 'to', 'protect', 'my', 'persephone']",nooo need protect persephone,nooo need protect persephon,0.3818,pos
"Mar 05, 2018",I missed this Webtoon more than Narcissus misses his reflection I'M SO HAPPY IT'S BACK!!!!! 🌹🌻🌼🌸,74,1,I missed this Webtoon more than Narcissus misses his reflection I M SO HAPPY IT S BACK ,i missed this webtoon more than narcissus misses his reflection i m so happy it s back ,"['i', 'missed', 'this', 'webtoon', 'more', 'than', 'narcissus', 'misses', 'his', 'reflection', 'i', 'm', 'so', 'happy', 'it', 's', 'back']",missed webtoon narcissus misses reflection happy back,missed webtoon narcissus misses reflection happy back,0.1531,pos
"Nov 07, 2019",And no one talks about that Persephone is Zeus's daughter and he was trying to distract his other daughter so than his brother could hook up with her... Greek mythology is the weirdest dude,68,1,And no one talks about that Persephone is Zeus s daughter and he was trying to distract his other daughter so than his brother could hook up with her Greek mythology is the weirdest dude,and no one talks about that persephone is zeus s daughter and he was trying to distract his other daughter so than his brother could hook up with her greek mythology is the weirdest dude,"['and', 'no', 'one', 'talks', 'about', 'that', 'persephone', 'is', 'zeus', 's', 'daughter', 'and', 'he', 'was', 'trying', 'to', 'distract', 'his', 'other', 'daughter', 'so', 'than', 'his', 'brother', 'could', 'hook', 'up', 'with', 'her', 'greek', 'mythology', 'is', 'the', 'weirdest', 'dude']",one talks persephone zeus daughter trying distract daughter brother could hook greek mythology weirdest dude,one talks persephone zeus daughter trying distract daughter brother could hook greek mythology weirdest dud,-0.6249,neg
"Mar 05, 2018",the portrait of the three-headed dog is Cerberus... guardian of the realm of Hades... Aphrodite is very cunning,60,0,the portrait of the three headed dog is Cerberus guardian of the realm of Hades Aphrodite is very cunning,the portrait of the three headed dog is cerberus guardian of the realm of hades aphrodite is very cunning,"['the', 'portrait', 'of', 'the', 'three', 'headed', 'dog', 'is', 'cerberus', 'guardian', 'of', 'the', 'realm', 'of', 'hades', 'aphrodite', 'is', 'very', 'cunning']",portrait three headed dog cerberus guardian realm hades aphrodite cunning,portrait three headed dog cerberus guardian realm hades aphrodite cun,0.0,neu
"Apr 05, 2019",I hope the reason Artemis hates Hades has something to do with her being a cat person 😂 Did Cerberus chase someone up a tree?,43,0,I hope the reason Artemis hates Hades has something to do with her being a cat person  Did Cerberus chase someone up a tree,i hope the reason artemis hates hades has something to do with her being a cat person  did cerberus chase someone up a tree,"['i', 'hope', 'the', 'reason', 'artemis', 'hates', 'hades', 'has', 'something', 'to', 'do', 'with', 'her', 'being', 'a', 'cat', 'person', 'did', 'cerberus', 'chase', 'someone', 'up', 'a', 'tree']",hope reason artemis hates hades something cat person cerberus chase someone tree,hope reason artemis hates hades something cat person cerberus chase someone tre,0.0,neu
"Mar 04, 2018",is she not that girl that had to spend half a year with Hades an half with her mother am. ot that good with name but i don't no why everbody don't like him he's a good guy an thanatos if yall know who that  is,41,0,is she not that girl that had to spend half a year with Hades an half with her mother am ot that good with name but i don t no why everbody don t like him he s a good guy an thanatos if yall know who that is,is she not that girl that had to spend half a year with hades an half with her mother am ot that good with name but i don t no why everbody don t like him he s a good guy an thanatos if yall know who that is,"['is', 'she', 'not', 'that', 'girl', 'that', 'had', 'to', 'spend', 'half', 'a', 'year', 'with', 'hades', 'an', 'half', 'with', 'her', 'mother', 'am', 'ot', 'that', 'good', 'with', 'name', 'but', 'i', 'don', 't', 'no', 'why', 'everbody', 'don', 't', 'like', 'him', 'he', 's', 'a', 'good', 'guy', 'an', 'thanatos', 'if', 'yall', 'know', 'who', 'that', 'is']",girl spend half year hades half mother ot good name everbody like good guy thanatos yall know,girl spend half year hades half mother ot good name everbody like good guy thanatos yall know,0.8074,pos
"Mar 05, 2018","she's in the underworld! Cerberus' picture is in the background! oh yeah, Cerberus means spot btw.",37,0,she s in the underworld Cerberus picture is in the background oh yeah Cerberus means spot btw,she s in the underworld cerberus picture is in the background oh yeah cerberus means spot btw,"['she', 's', 'in', 'the', 'underworld', 'cerberus', 'picture', 'is', 'in', 'the', 'background', 'oh', 'yeah', 'cerberus', 'means', 'spot', 'btw']",underworld cerberus picture background oh yeah cerberus means spot btw,underworld cerberus picture background oh yeah cerberus means spot btw,0.296,pos
"Mar 02, 2021",Who else is coming back to reread this from the most recent episode,29,0,Who else is coming back to reread this from the most recent episode,who else is coming back to reread this from the most recent episode,"['who', 'else', 'is', 'coming', 'back', 'to', 'reread', 'this', 'from', 'the', 'most', 'recent', 'episode']",else coming back reread recent episode,else coming back reread recent episod,0.0,neu
"Mar 08, 2018",who else thought for a sec that Eros was trying to make out with Persephone,28,0,who else thought for a sec that Eros was trying to make out with Persephone,who else thought for a sec that eros was trying to make out with persephone,"['who', 'else', 'thought', 'for', 'a', 'sec', 'that', 'eros', 'was', 'trying', 'to', 'make', 'out', 'with', 'persephone']",else thought sec eros trying make persephone,else thought sec eros trying make persephon,0.0,neu
"Mar 11, 2018",❤️ Hades is such a gentleman😢,172504,352,️ Hades is such a gentleman,️ hades is such a gentleman,"['️', 'hades', 'is', 'such', 'a', 'gentleman']",️ hades gentleman,️ hades gentleman,0.0,neu
"Mar 11, 2018","If this is following the myth of Eros and Pysche, it sucks that he hasn't been reunited with her..",78807,441,If this is following the myth of Eros and Pysche it sucks that he hasn t been reunited with her,if this is following the myth of eros and pysche it sucks that he hasn t been reunited with her,"['if', 'this', 'is', 'following', 'the', 'myth', 'of', 'eros', 'and', 'pysche', 'it', 'sucks', 'that', 'he', 'hasn', 't', 'been', 'reunited', 'with', 'her']",following myth eros pysche sucks reunited,following myth eros pysche sucks reunit,-0.3612,neg
"Mar 11, 2018",“She’s the personification of a cinnamon roll. A pink cinnamon roll.” Eros is one of the fandom,36913,74,“She’s the personification of a cinnamon roll A pink cinnamon roll ” Eros is one of the fandom,“she’s the personification of a cinnamon roll a pink cinnamon roll ” eros is one of the fandom,"['“', 'she', '’', 's', 'the', 'personification', 'of', 'a', 'cinnamon', 'roll', 'a', 'pink', 'cinnamon', 'roll', '”', 'eros', 'is', 'one', 'of', 'the', 'fandom']",“ ’ personification cinnamon roll pink cinnamon roll ” eros one fandom,“ ’ personification cinnamon roll pink cinnamon roll ” eros one fandom,0.0,neu
"Mar 11, 2018","People wonder why Aphrodite doesn't like the sweet cinnamon roll known as Persephone, I say that it's because she's made of SALTY sea foam!..... Okay, I leave.",2914,5,People wonder why Aphrodite doesn t like the sweet cinnamon roll known as Persephone I say that it s because she s made of SALTY sea foam Okay I leave,people wonder why aphrodite doesn t like the sweet cinnamon roll known as persephone i say that it s because she s made of salty sea foam okay i leave,"['people', 'wonder', 'why', 'aphrodite', 'doesn', 't', 'like', 'the', 'sweet', 'cinnamon', 'roll', 'known', 'as', 'persephone', 'i', 'say', 'that', 'it', 's', 'because', 'she', 's', 'made', 'of', 'salty', 'sea', 'foam', 'okay', 'i', 'leave']",people wonder aphrodite like sweet cinnamon roll known persephone say made salty sea foam okay leave,people wonder aphrodite like sweet cinnamon roll known persephone say made salty sea foam okay leav,0.7506,pos
"Mar 11, 2018",“WHY ARE YOU JEALOUS OF A CINNAMON-ROLL?!” Best. Line. Ever.,2551,4,“WHY ARE YOU JEALOUS OF A CINNAMON ROLL ” Best Line Ever,“why are you jealous of a cinnamon roll ” best line ever,"['“', 'why', 'are', 'you', 'jealous', 'of', 'a', 'cinnamon', 'roll', '”', 'best', 'line', 'ever']",“ jealous cinnamon roll ” best line ever,“ jealous cinnamon roll ” best line ev,0.296,pos
"Mar 11, 2018","Hades is the only god I like in Greek Mythology. All the other Gods raped, stole, killed, but Hades basically just did his damn job.",1998,8,Hades is the only god I like in Greek Mythology All the other Gods raped stole killed but Hades basically just did his damn job,hades is the only god i like in greek mythology all the other gods raped stole killed but hades basically just did his damn job,"['hades', 'is', 'the', 'only', 'god', 'i', 'like', 'in', 'greek', 'mythology', 'all', 'the', 'other', 'gods', 'raped', 'stole', 'killed', 'but', 'hades', 'basically', 'just', 'did', 'his', 'damn', 'job']",hades god like greek mythology gods raped stole killed hades basically damn job,hades god like greek mythology gods raped stole killed hades basically damn job,-0.8481,neg
"Mar 11, 2018","See, even Eros knows about how much of a cinnamon roll she is.",1459,2,See even Eros knows about how much of a cinnamon roll she is,see even eros knows about how much of a cinnamon roll she is,"['see', 'even', 'eros', 'knows', 'about', 'how', 'much', 'of', 'a', 'cinnamon', 'roll', 'she', 'is']",see even eros knows much cinnamon roll,see even eros knows much cinnamon rol,0.0,neu
"Mar 11, 2018",Aphrodite: the pettiest goddess on Olympus. Persephone: a pink adorable cinnamonroll.,1378,7,Aphrodite the pettiest goddess on Olympus Persephone a pink adorable cinnamonroll,aphrodite the pettiest goddess on olympus persephone a pink adorable cinnamonroll,"['aphrodite', 'the', 'pettiest', 'goddess', 'on', 'olympus', 'persephone', 'a', 'pink', 'adorable', 'cinnamonroll']",aphrodite pettiest goddess olympus persephone pink adorable cinnamonroll,aphrodite pettiest goddess olympus persephone pink adorable cinnamonrol,0.2263,pos
"Mar 11, 2018","""I might be a lot of things but I ain't no snitch"" Hades must be hella fun to hang out with. EDIT:ur mum gay lol",1055,18,I might be a lot of things but I ain t no snitch Hades must be hella fun to hang out with EDIT ur mum gay lol,i might be a lot of things but i ain t no snitch hades must be hella fun to hang out with edit ur mum gay lol,"['i', 'might', 'be', 'a', 'lot', 'of', 'things', 'but', 'i', 'ain', 't', 'no', 'snitch', 'hades', 'must', 'be', 'hella', 'fun', 'to', 'hang', 'out', 'with', 'edit', 'ur', 'mum', 'gay', 'lol']",might lot things snitch hades must hella fun hang edit ur mum gay lol,might lot things snitch hades must hella fun hang edit ur mum gay lol,0.7501,pos
"Mar 11, 2018","Goodness, Hades has to be one of the best gentlemen in all of Webtoons. He’s seriously raising the standards for male romance leads, XD",933,4,Goodness Hades has to be one of the best gentlemen in all of Webtoons He’s seriously raising the standards for male romance leads XD,goodness hades has to be one of the best gentlemen in all of webtoons he’s seriously raising the standards for male romance leads xd,"['goodness', 'hades', 'has', 'to', 'be', 'one', 'of', 'the', 'best', 'gentlemen', 'in', 'all', 'of', 'webtoons', 'he', '’', 's', 'seriously', 'raising', 'the', 'standards', 'for', 'male', 'romance', 'leads', 'xd']",goodness hades one best gentlemen webtoons ’ seriously raising standards male romance leads xd,goodness hades one best gentlemen webtoons ’ seriously raising standards male romance leads xd,0.9313,pos
"Mar 11, 2018","Okay, let’s talk about consent and how Hades follows it! She’s drunk and he doesn’t take advantage of her! TAKE NOTES PEOPLE. TAKE NOTES.",879,4,Okay let’s talk about consent and how Hades follows it She’s drunk and he doesn’t take advantage of her TAKE NOTES PEOPLE TAKE NOTES,okay let’s talk about consent and how hades follows it she’s drunk and he doesn’t take advantage of her take notes people take notes,"['okay', 'let', '’', 's', 'talk', 'about', 'consent', 'and', 'how', 'hades', 'follows', 'it', 'she', '’', 's', 'drunk', 'and', 'he', 'doesn', '’', 't', 'take', 'advantage', 'of', 'her', 'take', 'notes', 'people', 'take', 'notes']",okay let ’ talk consent hades follows ’ drunk ’ take advantage take notes people take notes,okay let ’ talk consent hades follows ’ drunk ’ take advantage take notes people take not,0.34,pos
"Mar 11, 2018",(Deep Inhale) SO. PURE.,617,3,Deep Inhale SO PURE,deep inhale so pure,"['deep', 'inhale', 'so', 'pure']",deep inhale pure,deep inhale pur,0.0,neu
"Mar 11, 2018","eeepppp!! the way he calls her ""sweetness"" ... where can I get a Hades ??",480,1,eeepppp the way he calls her sweetness where can I get a Hades,eeepppp the way he calls her sweetness where can i get a hades,"['eeepppp', 'the', 'way', 'he', 'calls', 'her', 'sweetness', 'where', 'can', 'i', 'get', 'a', 'hades']",eeepppp way calls sweetness get hades,eeepppp way calls sweetness get had,0.4939,pos
"Mar 11, 2018",;-; hades is such a caring man for the title of the ruler of the underworld  Edit: thanks for all the comments and facts 👍🙌,447,1,hades is such a caring man for the title of the ruler of the underworld Edit thanks for all the comments and facts ,hades is such a caring man for the title of the ruler of the underworld edit thanks for all the comments and facts ,"['hades', 'is', 'such', 'a', 'caring', 'man', 'for', 'the', 'title', 'of', 'the', 'ruler', 'of', 'the', 'underworld', 'edit', 'thanks', 'for', 'all', 'the', 'comments', 'and', 'facts']",hades caring man title ruler underworld edit thanks comments facts,hades caring man title ruler underworld edit thanks comments fact,0.7269,pos
"Mar 11, 2018",omg i just noticed the little post it with a heart on her thigh when she was dead drunk 😂😂😂,343,1,omg i just noticed the little post it with a heart on her thigh when she was dead drunk ,omg i just noticed the little post it with a heart on her thigh when she was dead drunk ,"['omg', 'i', 'just', 'noticed', 'the', 'little', 'post', 'it', 'with', 'a', 'heart', 'on', 'her', 'thigh', 'when', 'she', 'was', 'dead', 'drunk']",omg noticed little post heart thigh dead drunk,omg noticed little post heart thigh dead drunk,-0.4173,neg
"Mar 11, 2018",KISSKISSFALLINLOVE,308,4,KISSKISSFALLINLOVE,kisskissfallinlove,['kisskissfallinlove'],kisskissfallinlove,kisskissfallinlov,0.0,neu
"Mar 11, 2018","Out of all the comics I've read on webtoon this one has to be the most visually interesting I've seen yet. Mainly in the use of color, line and value. The bright hues of the characters and how they stand out against the backgrounds as well as how they're used to identify and differentiate between the cast. All together it really makes for a dynamic look that's simultaneously striking and subtle. So glad I subbed to this series. 👍🙌🌟❤",301,0,Out of all the comics I ve read on webtoon this one has to be the most visually interesting I ve seen yet Mainly in the use of color line and value The bright hues of the characters and how they stand out against the backgrounds as well as how they re used to identify and differentiate between the cast All together it really makes for a dynamic look that s simultaneously striking and subtle So glad I subbed to this series ,out of all the comics i ve read on webtoon this one has to be the most visually interesting i ve seen yet mainly in the use of color line and value the bright hues of the characters and how they stand out against the backgrounds as well as how they re used to identify and differentiate between the cast all together it really makes for a dynamic look that s simultaneously striking and subtle so glad i subbed to this series ,"['out', 'of', 'all', 'the', 'comics', 'i', 've', 'read', 'on', 'webtoon', 'this', 'one', 'has', 'to', 'be', 'the', 'most', 'visually', 'interesting', 'i', 've', 'seen', 'yet', 'mainly', 'in', 'the', 'use', 'of', 'color', 'line', 'and', 'value', 'the', 'bright', 'hues', 'of', 'the', 'characters', 'and', 'how', 'they', 'stand', 'out', 'against', 'the', 'backgrounds', 'as', 'well', 'as', 'how', 'they', 're', 'used', 'to', 'identify', 'and', 'differentiate', 'between', 'the', 'cast', 'all', 'together', 'it', 'really', 'makes', 'for', 'a', 'dynamic', 'look', 'that', 's', 'simultaneously', 'striking', 'and', 'subtle', 'so', 'glad', 'i', 'subbed', 'to', 'this', 'series']",comics read webtoon one visually interesting seen yet mainly use color line value bright hues characters stand backgrounds well used identify differentiate cast together really makes dynamic look simultaneously striking subtle glad subbed series,comics read webtoon one visually interesting seen yet mainly use color line value bright hues characters stand backgrounds well used identify differentiate cast together really makes dynamic look simultaneously striking subtle glad subbed seri,0.9322,pos
"Mar 11, 2018",Eros’ complaints are literally me to myself everyday,249,0,Eros’ complaints are literally me to myself everyday,eros’ complaints are literally me to myself everyday,"['eros', '’', 'complaints', 'are', 'literally', 'me', 'to', 'myself', 'everyday']",eros ’ complaints literally everyday,eros ’ complaints literally everyday,-0.4019,neg
"Mar 11, 2018","I just...I’m gonna cry. You don’t know how much color means to me. I REALLY love colors, they’re just so pretty and the ship is so cute I love it so much.",230,0,I just I’m gonna cry You don’t know how much color means to me I REALLY love colors they’re just so pretty and the ship is so cute I love it so much,i just i’m gonna cry you don’t know how much color means to me i really love colors they’re just so pretty and the ship is so cute i love it so much,"['i', 'just', 'i', '’', 'm', 'gon', 'na', 'cry', 'you', 'don', '’', 't', 'know', 'how', 'much', 'color', 'means', 'to', 'me', 'i', 'really', 'love', 'colors', 'they', '’', 're', 'just', 'so', 'pretty', 'and', 'the', 'ship', 'is', 'so', 'cute', 'i', 'love', 'it', 'so', 'much']",’ gon na cry ’ know much color means really love colors ’ pretty ship cute love much,’ gon na cry ’ know much color means really love colors ’ pretty ship cute love much,0.9152,pos
"Mar 11, 2018","You know, for a person who was just orchestrating an orgy a few moments ago and is the god of sexual love, Eros is a pretty cool dude so far. He seems to not like doing this very much and thinks of Persephone with pure thoughts of her being an adorable cinnamon roll, which she clearly is. Only reason why he's really doing this is because it's his mom and because of his true love Phyche. I think he is now one of the best do far now",215,3,You know for a person who was just orchestrating an orgy a few moments ago and is the god of sexual love Eros is a pretty cool dude so far He seems to not like doing this very much and thinks of Persephone with pure thoughts of her being an adorable cinnamon roll which she clearly is Only reason why he s really doing this is because it s his mom and because of his true love Phyche I think he is now one of the best do far now,you know for a person who was just orchestrating an orgy a few moments ago and is the god of sexual love eros is a pretty cool dude so far he seems to not like doing this very much and thinks of persephone with pure thoughts of her being an adorable cinnamon roll which she clearly is only reason why he s really doing this is because it s his mom and because of his true love phyche i think he is now one of the best do far now,"['you', 'know', 'for', 'a', 'person', 'who', 'was', 'just', 'orchestrating', 'an', 'orgy', 'a', 'few', 'moments', 'ago', 'and', 'is', 'the', 'god', 'of', 'sexual', 'love', 'eros', 'is', 'a', 'pretty', 'cool', 'dude', 'so', 'far', 'he', 'seems', 'to', 'not', 'like', 'doing', 'this', 'very', 'much', 'and', 'thinks', 'of', 'persephone', 'with', 'pure', 'thoughts', 'of', 'her', 'being', 'an', 'adorable', 'cinnamon', 'roll', 'which', 'she', 'clearly', 'is', 'only', 'reason', 'why', 'he', 's', 'really', 'doing', 'this', 'is', 'because', 'it', 's', 'his', 'mom', 'and', 'because', 'of', 'his', 'true', 'love', 'phyche', 'i', 'think', 'he', 'is', 'now', 'one', 'of', 'the', 'best', 'do', 'far', 'now']",know person orchestrating orgy moments ago god sexual love eros pretty cool dude far seems like much thinks persephone pure thoughts adorable cinnamon roll clearly reason really mom true love phyche think one best far,know person orchestrating orgy moments ago god sexual love eros pretty cool dude far seems like much thinks persephone pure thoughts adorable cinnamon roll clearly reason really mom true love phyche think one best far,0.9848,pos
"Mar 11, 2018","Does anybody else imagine Hades having a deep, soft British accent? Or is it just me?",182,1,Does anybody else imagine Hades having a deep soft British accent Or is it just me,does anybody else imagine hades having a deep soft british accent or is it just me,"['does', 'anybody', 'else', 'imagine', 'hades', 'having', 'a', 'deep', 'soft', 'british', 'accent', 'or', 'is', 'it', 'just', 'me']",anybody else imagine hades deep soft british accent,anybody else imagine hades deep soft british acc,0.0,neu
"Mar 11, 2018","dammit, Aphrodite. dont be a thot.",147,2,dammit Aphrodite dont be a thot,dammit aphrodite dont be a thot,"['dammit', 'aphrodite', 'dont', 'be', 'a', 'thot']",dammit aphrodite dont thot,dammit aphrodite dont thot,0.0,neu
"Mar 18, 2018","""man how big is this place?"" me: How big is your hair???",186540,344,man how big is this place me How big is your hair,man how big is this place me how big is your hair,"['man', 'how', 'big', 'is', 'this', 'place', 'me', 'how', 'big', 'is', 'your', 'hair']",man big place big hair,man big place big hair,0.0,neu
"Mar 18, 2018",PERSEPHONE THICCCCCC LIKE Honestly,149747,1221,PERSEPHONE THICCCCCC LIKE Honestly,persephone thicccccc like honestly,"['persephone', 'thicccccc', 'like', 'honestly']",persephone thicccccc like honestly,persephone thicccccc like honestli,0.3612,pos
"Mar 18, 2018",Demeter needs to CHILL,103531,415,Demeter needs to CHILL,demeter needs to chill,"['demeter', 'needs', 'to', 'chill']",demeter needs chill,demeter needs chil,0.0,neu
"Mar 18, 2018",It's sad that the reason why Demeter was so protective over Persephone was because Demeter was raped by Zues and so Demeter was so violently over bearing with Persephone because she never wanted that to happen to her,4764,12,It s sad that the reason why Demeter was so protective over Persephone was because Demeter was raped by Zues and so Demeter was so violently over bearing with Persephone because she never wanted that to happen to her,it s sad that the reason why demeter was so protective over persephone was because demeter was raped by zues and so demeter was so violently over bearing with persephone because she never wanted that to happen to her,"['it', 's', 'sad', 'that', 'the', 'reason', 'why', 'demeter', 'was', 'so', 'protective', 'over', 'persephone', 'was', 'because', 'demeter', 'was', 'raped', 'by', 'zues', 'and', 'so', 'demeter', 'was', 'so', 'violently', 'over', 'bearing', 'with', 'persephone', 'because', 'she', 'never', 'wanted', 'that', 'to', 'happen', 'to', 'her']",sad reason demeter protective persephone demeter raped zues demeter violently bearing persephone never wanted happen,sad reason demeter protective persephone demeter raped zues demeter violently bearing persephone never wanted happen,-0.91,neg
"Mar 18, 2018",'time to make a swift exit' *proceeds to get lost *,2605,2,time to make a swift exit proceeds to get lost,time to make a swift exit proceeds to get lost,"['time', 'to', 'make', 'a', 'swift', 'exit', 'proceeds', 'to', 'get', 'lost']",time make swift exit proceeds get lost,time make swift exit proceeds get lost,-0.128,neg
"Mar 18, 2018",IS ANYONE GOING TO TALK ABOUT HOW HER HAIR WENT FROM A PIXIE CUT TO RAPUNZEL HAIR?!?!?!?!?!,2354,5,IS ANYONE GOING TO TALK ABOUT HOW HER HAIR WENT FROM A PIXIE CUT TO RAPUNZEL HAIR,is anyone going to talk about how her hair went from a pixie cut to rapunzel hair,"['is', 'anyone', 'going', 'to', 'talk', 'about', 'how', 'her', 'hair', 'went', 'from', 'a', 'pixie', 'cut', 'to', 'rapunzel', 'hair']",anyone going talk hair went pixie cut rapunzel hair,anyone going talk hair went pixie cut rapunzel hair,-0.2732,neg
