Date,Comment,Like,Dislike,Clean_comment,Comment_Lower,Summary_Tokenized,Comment_no_stopwords,Comments_stem,Sentiment score,Sentiment category
"Mar 18, 2018",Is It Just Me or Was That Like Super Sexy The Way He Came Up Behind Her 😍😍,1498,18,Is It Just Me or Was That Like Super Sexy The Way He Came Up Behind Her ,is it just me or was that like super sexy the way he came up behind her ,"['is', 'it', 'just', 'me', 'or', 'was', 'that', 'like', 'super', 'sexy', 'the', 'way', 'he', 'came', 'up', 'behind', 'her']",like super sexy way came behind,like super sexy way came behind,0.8689,pos
"Mar 18, 2018",I got so scared when it turned all red 😨,841,3,I got so scared when it turned all red ,i got so scared when it turned all red ,"['i', 'got', 'so', 'scared', 'when', 'it', 'turned', 'all', 'red']",got scared turned red,got scared turned r,-0.4404,neg
"Mar 18, 2018",I am officially referring to Persephone and Hades as Persades!!! who's with me?!,831,17,I am officially referring to Persephone and Hades as Persades who s with me,i am officially referring to persephone and hades as persades who s with me,"['i', 'am', 'officially', 'referring', 'to', 'persephone', 'and', 'hades', 'as', 'persades', 'who', 's', 'with', 'me']",officially referring persephone hades persades,officially referring persephone hades persad,0.0,neu
"Mar 18, 2018",PERSEPHONE WHAT IS YOUR POSTURE,727,2,PERSEPHONE WHAT IS YOUR POSTURE,persephone what is your posture,"['persephone', 'what', 'is', 'your', 'posture']",persephone posture,persephone postur,0.0,neu
"Mar 18, 2018",when you go from reading Percy Jackson to reading Lore Olympus😍,682,9,when you go from reading Percy Jackson to reading Lore Olympus,when you go from reading percy jackson to reading lore olympus,"['when', 'you', 'go', 'from', 'reading', 'percy', 'jackson', 'to', 'reading', 'lore', 'olympus']",go reading percy jackson reading lore olympus,go reading percy jackson reading lore olympu,0.0,neu
"Mar 18, 2018",Did he follow her hair to find her???,544,1,Did he follow her hair to find her,did he follow her hair to find her,"['did', 'he', 'follow', 'her', 'hair', 'to', 'find', 'her']",follow hair find,follow hair find,0.0,neu
"Mar 18, 2018",For a second there is Persephone's dream was a flashback and i was just like DANG I KNEW DEMETER WAS PROTECTIVE BUT HOLY SHITE!,383,1,For a second there is Persephone s dream was a flashback and i was just like DANG I KNEW DEMETER WAS PROTECTIVE BUT HOLY SHITE,for a second there is persephone s dream was a flashback and i was just like dang i knew demeter was protective but holy shite,"['for', 'a', 'second', 'there', 'is', 'persephone', 's', 'dream', 'was', 'a', 'flashback', 'and', 'i', 'was', 'just', 'like', 'dang', 'i', 'knew', 'demeter', 'was', 'protective', 'but', 'holy', 'shite']",second persephone dream flashback like dang knew demeter protective holy shite,second persephone dream flashback like dang knew demeter protective holy shit,-0.0258,neu
"Mar 18, 2018","Why, hello tall, dark, and handsome.",314,2,Why hello tall dark and handsome,why hello tall dark and handsome,"['why', 'hello', 'tall', 'dark', 'and', 'handsome']",hello tall dark handsome,hello tall dark handsom,0.0,neu
"Mar 18, 2018",I’m obsessed with this webtoon😝,239,4,I’m obsessed with this webtoon,i’m obsessed with this webtoon,"['i', '’', 'm', 'obsessed', 'with', 'this', 'webtoon']",’ obsessed webtoon,’ obsessed webtoon,-0.1779,neg
"Mar 18, 2018",I have a quick question what ungodly powers are y'all using to comment first,221,4,I have a quick question what ungodly powers are y all using to comment first,i have a quick question what ungodly powers are y all using to comment first,"['i', 'have', 'a', 'quick', 'question', 'what', 'ungodly', 'powers', 'are', 'y', 'all', 'using', 'to', 'comment', 'first']",quick question ungodly powers using comment first,quick question ungodly powers using comment first,0.0,neu
"Mar 18, 2018",And so it begins *grabs popcorn*,194,1,And so it begins grabs popcorn,and so it begins grabs popcorn,"['and', 'so', 'it', 'begins', 'grabs', 'popcorn']",begins grabs popcorn,begins grabs popcorn,0.0,neu
"Mar 18, 2018","*sees cute animal in other persons house* ""heyah buddy!"" *animal growls* *sheds tear*",174,2,sees cute animal in other persons house heyah buddy animal growls sheds tear,sees cute animal in other persons house heyah buddy animal growls sheds tear,"['sees', 'cute', 'animal', 'in', 'other', 'persons', 'house', 'heyah', 'buddy', 'animal', 'growls', 'sheds', 'tear']",sees cute animal persons house heyah buddy animal growls sheds tear,sees cute animal persons house heyah buddy animal growls sheds tear,0.4588,pos
"Mar 18, 2018",their height difference kills me💕😢,169,2,their height difference kills me,their height difference kills me,"['their', 'height', 'difference', 'kills', 'me']",height difference kills,height difference kil,0.0,neu
"Mar 18, 2018",Percy Jackson fans where y'all at?,155,7,Percy Jackson fans where y all at,percy jackson fans where y all at,"['percy', 'jackson', 'fans', 'where', 'y', 'all', 'at']",percy jackson fans,percy jackson fan,0.3182,pos
"Mar 18, 2018",honestly I'm still wondering how she can wear that dress without it just exposing everything like WTH...,127,2,honestly I m still wondering how she can wear that dress without it just exposing everything like WTH,honestly i m still wondering how she can wear that dress without it just exposing everything like wth,"['honestly', 'i', 'm', 'still', 'wondering', 'how', 'she', 'can', 'wear', 'that', 'dress', 'without', 'it', 'just', 'exposing', 'everything', 'like', 'wth']",honestly still wondering wear dress without exposing everything like wth,honestly still wondering wear dress without exposing everything like wth,-0.1769,neg
"Mar 18, 2018",can you spell S H I P???,109,3,can you spell S H I P,can you spell s h i p,"['can', 'you', 'spell', 's', 'h', 'i', 'p']",spell h p,spell h p,0.0,neu
"Mar 18, 2018",Tangled but its Persephone,94,0,Tangled but its Persephone,tangled but its persephone,"['tangled', 'but', 'its', 'persephone']",tangled persephone,tangled persephon,0.0,neu
"Mar 25, 2018","Proof that Persephone is even more of a cinnamonroll: she can tame Cerberus, one of the most terrifying gatekeepers of the Underworld. 😂",158180,292,Proof that Persephone is even more of a cinnamonroll she can tame Cerberus one of the most terrifying gatekeepers of the Underworld ,proof that persephone is even more of a cinnamonroll she can tame cerberus one of the most terrifying gatekeepers of the underworld ,"['proof', 'that', 'persephone', 'is', 'even', 'more', 'of', 'a', 'cinnamonroll', 'she', 'can', 'tame', 'cerberus', 'one', 'of', 'the', 'most', 'terrifying', 'gatekeepers', 'of', 'the', 'underworld']",proof persephone even cinnamonroll tame cerberus one terrifying gatekeepers underworld,proof persephone even cinnamonroll tame cerberus one terrifying gatekeepers underworld,-0.5719,neg
"Mar 25, 2018","she got so flustered by her connection with hades , a flower crown popped up 😂",134842,262,she got so flustered by her connection with hades a flower crown popped up ,she got so flustered by her connection with hades a flower crown popped up ,"['she', 'got', 'so', 'flustered', 'by', 'her', 'connection', 'with', 'hades', 'a', 'flower', 'crown', 'popped', 'up']",got flustered connection hades flower crown popped,got flustered connection hades flower crown pop,-0.25,neg
"Mar 25, 2018",Okay but Persephone just looks so fluffy and adorable with the clothes he gave her..,112364,312,Okay but Persephone just looks so fluffy and adorable with the clothes he gave her,okay but persephone just looks so fluffy and adorable with the clothes he gave her,"['okay', 'but', 'persephone', 'just', 'looks', 'so', 'fluffy', 'and', 'adorable', 'with', 'the', 'clothes', 'he', 'gave', 'her']",okay persephone looks fluffy adorable clothes gave,okay persephone looks fluffy adorable clothes gav,0.6249,pos
"Mar 25, 2018",You look sufficient. OKAY QTIP,2818,2,You look sufficient OKAY QTIP,you look sufficient okay qtip,"['you', 'look', 'sufficient', 'okay', 'qtip']",look sufficient okay qtip,look sufficient okay qtip,0.2263,pos
"Mar 25, 2018",cerberus: 1 hades: 0,2461,4,cerberus 1 hades 0,cerberus 1 hades 0,"['cerberus', '1', 'hades', '0']",cerberus 1 hades 0,cerberus 1 hades 0,0.0,neu
"Mar 25, 2018",“it’s not like i’m going to wear it” ...i want to see him wear the coat now.,2137,4,“it’s not like i’m going to wear it” i want to see him wear the coat now,“it’s not like i’m going to wear it” i want to see him wear the coat now,"['“', 'it', '’', 's', 'not', 'like', 'i', '’', 'm', 'going', 'to', 'wear', 'it', '”', 'i', 'want', 'to', 'see', 'him', 'wear', 'the', 'coat', 'now']",“ ’ like ’ going wear ” want see wear coat,“ ’ like ’ going wear ” want see wear coat,0.4215,pos
"Mar 25, 2018",first of all DAMN HADES U LOOKIN FINE. second PERSEPHONE OMG GURL U LOOKIN GOOD IN THAT SWEATER/FLOOFY JACKET,1303,3,first of all DAMN HADES U LOOKIN FINE second PERSEPHONE OMG GURL U LOOKIN GOOD IN THAT SWEATER FLOOFY JACKET,first of all damn hades u lookin fine second persephone omg gurl u lookin good in that sweater floofy jacket,"['first', 'of', 'all', 'damn', 'hades', 'u', 'lookin', 'fine', 'second', 'persephone', 'omg', 'gurl', 'u', 'lookin', 'good', 'in', 'that', 'sweater', 'floofy', 'jacket']",first damn hades u lookin fine second persephone omg gurl u lookin good sweater floofy jacket,first damn hades u lookin fine second persephone omg gurl u lookin good sweater floofy jacket,0.25,pos
"Mar 25, 2018",Does the flower crown respresent Persophone being turned on?,982,8,Does the flower crown respresent Persophone being turned on,does the flower crown respresent persophone being turned on,"['does', 'the', 'flower', 'crown', 'respresent', 'persophone', 'being', 'turned', 'on']",flower crown respresent persophone turned,flower crown respresent persophone turn,0.0,neu
"Mar 25, 2018",When you get so nervous around your crush that you turn into a Snapchat filter,819,1,When you get so nervous around your crush that you turn into a Snapchat filter,when you get so nervous around your crush that you turn into a snapchat filter,"['when', 'you', 'get', 'so', 'nervous', 'around', 'your', 'crush', 'that', 'you', 'turn', 'into', 'a', 'snapchat', 'filter']",get nervous around crush turn snapchat filter,get nervous around crush turn snapchat filt,-0.4019,neg
"Mar 25, 2018",sh*t sh*t sh*t is what I do when my report card comes in,773,1,sh t sh t sh t is what I do when my report card comes in,sh t sh t sh t is what i do when my report card comes in,"['sh', 't', 'sh', 't', 'sh', 't', 'is', 'what', 'i', 'do', 'when', 'my', 'report', 'card', 'comes', 'in']",sh sh sh report card comes,sh sh sh report card com,0.0,neu
"Mar 25, 2018","I love how Persephone doesn’t even ask how she got there, or why for that matter 😂",605,3,I love how Persephone doesn’t even ask how she got there or why for that matter ,i love how persephone doesn’t even ask how she got there or why for that matter ,"['i', 'love', 'how', 'persephone', 'doesn', '’', 't', 'even', 'ask', 'how', 'she', 'got', 'there', 'or', 'why', 'for', 'that', 'matter']",love persephone ’ even ask got matter,love persephone ’ even ask got matt,0.6369,pos
"Mar 25, 2018",Look at Persephone just so chill that she woke up in the underworld and was tended to by the God of death.😎Hades you the man.,560,1,Look at Persephone just so chill that she woke up in the underworld and was tended to by the God of death Hades you the man,look at persephone just so chill that she woke up in the underworld and was tended to by the god of death hades you the man,"['look', 'at', 'persephone', 'just', 'so', 'chill', 'that', 'she', 'woke', 'up', 'in', 'the', 'underworld', 'and', 'was', 'tended', 'to', 'by', 'the', 'god', 'of', 'death', 'hades', 'you', 'the', 'man']",look persephone chill woke underworld tended god death hades man,look persephone chill woke underworld tended god death hades man,-0.4215,neg
"Mar 25, 2018",I wish that I could grow a flower crown and become 10000000x cuter when I talk to a hot guy. Instead I say every stupid thing possible and sweat profusely.,472,0,I wish that I could grow a flower crown and become 10000000x cuter when I talk to a hot guy Instead I say every stupid thing possible and sweat profusely,i wish that i could grow a flower crown and become 10000000x cuter when i talk to a hot guy instead i say every stupid thing possible and sweat profusely,"['i', 'wish', 'that', 'i', 'could', 'grow', 'a', 'flower', 'crown', 'and', 'become', '10000000x', 'cuter', 'when', 'i', 'talk', 'to', 'a', 'hot', 'guy', 'instead', 'i', 'say', 'every', 'stupid', 'thing', 'possible', 'and', 'sweat', 'profusely']",wish could grow flower crown become 10000000x cuter talk hot guy instead say every stupid thing possible sweat profusely,wish could grow flower crown become 10000000x cuter talk hot guy instead say every stupid thing possible sweat profus,0.3818,pos
"Mar 25, 2018",When your ex calls while you're with your boo,361,0,When your ex calls while you re with your boo,when your ex calls while you re with your boo,"['when', 'your', 'ex', 'calls', 'while', 'you', 're', 'with', 'your', 'boo']",ex calls boo,ex calls boo,0.0,neu
"Mar 25, 2018",THE COLORS. WHENEVER I SEE THAT SHADE OF BLUE I THINK OF HADES.,276,0,THE COLORS WHENEVER I SEE THAT SHADE OF BLUE I THINK OF HADES,the colors whenever i see that shade of blue i think of hades,"['the', 'colors', 'whenever', 'i', 'see', 'that', 'shade', 'of', 'blue', 'i', 'think', 'of', 'hades']",colors whenever see shade blue think hades,colors whenever see shade blue think had,0.0,neu
"Mar 25, 2018","""Shit shit shit shit shit!"" Hades is a pretty big mood this chapter",267,1,Shit shit shit shit shit Hades is a pretty big mood this chapter,shit shit shit shit shit hades is a pretty big mood this chapter,"['shit', 'shit', 'shit', 'shit', 'shit', 'hades', 'is', 'a', 'pretty', 'big', 'mood', 'this', 'chapter']",shit shit shit shit shit hades pretty big mood chapter,shit shit shit shit shit hades pretty big mood chapt,-0.9413,neg
"Mar 25, 2018","Does Cerberus changes it's size at will? In a panel it was huge and then, in other was like any other dog. Also, Cerberus it's super duper cute. Just like it's master. 😄😊",238,0,Does Cerberus changes it s size at will In a panel it was huge and then in other was like any other dog Also Cerberus it s super duper cute Just like it s master ,does cerberus changes it s size at will in a panel it was huge and then in other was like any other dog also cerberus it s super duper cute just like it s master ,"['does', 'cerberus', 'changes', 'it', 's', 'size', 'at', 'will', 'in', 'a', 'panel', 'it', 'was', 'huge', 'and', 'then', 'in', 'other', 'was', 'like', 'any', 'other', 'dog', 'also', 'cerberus', 'it', 's', 'super', 'duper', 'cute', 'just', 'like', 'it', 's', 'master']",cerberus changes size panel huge like dog also cerberus super duper cute like master,cerberus changes size panel huge like dog also cerberus super duper cute like mast,0.9217,pos
"Mar 25, 2018",Hades is jealous of the Cerberus but I'm jealous of Persephone. I want to pet the dog too!!!!,205,0,Hades is jealous of the Cerberus but I m jealous of Persephone I want to pet the dog too,hades is jealous of the cerberus but i m jealous of persephone i want to pet the dog too,"['hades', 'is', 'jealous', 'of', 'the', 'cerberus', 'but', 'i', 'm', 'jealous', 'of', 'persephone', 'i', 'want', 'to', 'pet', 'the', 'dog', 'too']",hades jealous cerberus jealous persephone want pet dog,hades jealous cerberus jealous persephone want pet dog,-0.6908,neg
"Mar 25, 2018",🎶Kiss kiss fall in love🎶,177,3,Kiss kiss fall in love,kiss kiss fall in love,"['kiss', 'kiss', 'fall', 'in', 'love']",kiss kiss fall love,kiss kiss fall lov,0.6808,pos
"Mar 25, 2018","Hades, your gold digging nymph is calling.",170,2,Hades your gold digging nymph is calling,hades your gold digging nymph is calling,"['hades', 'your', 'gold', 'digging', 'nymph', 'is', 'calling']",hades gold digging nymph calling,hades gold digging nymph cal,0.0,neu
"Mar 25, 2018","Hades: ""You look..."" Gorgeous, radiant, beautiful, stunning. ""Sufficient.""  Everyone else: *Face palm*",149,0,Hades You look Gorgeous radiant beautiful stunning Sufficient Everyone else Face palm,hades you look gorgeous radiant beautiful stunning sufficient everyone else face palm,"['hades', 'you', 'look', 'gorgeous', 'radiant', 'beautiful', 'stunning', 'sufficient', 'everyone', 'else', 'face', 'palm']",hades look gorgeous radiant beautiful stunning sufficient everyone else face palm,hades look gorgeous radiant beautiful stunning sufficient everyone else face palm,0.9274,pos
"Mar 25, 2018",she looks like she's covered in cotten candy,126,0,she looks like she s covered in cotten candy,she looks like she s covered in cotten candy,"['she', 'looks', 'like', 'she', 's', 'covered', 'in', 'cotten', 'candy']",looks like covered cotten candy,looks like covered cotten candi,0.3612,pos
"Mar 25, 2018","Oh my Gods! that ""wait a second. Shiiiiit. Shit shit shit"" had me laughing sooo bad... and at the same time so AWWWW he is worried about her. Cerberus face when she scratches his chin.. ""lets just say i can see Hades getting jelous. I just loved those glances they give each other like trying to understand the conection they are feeling. So new and exiting. SOOO cant not wait another week for a new episode. Damn cliffhangers more",114,0,Oh my Gods that wait a second Shiiiiit Shit shit shit had me laughing sooo bad and at the same time so AWWWW he is worried about her Cerberus face when she scratches his chin lets just say i can see Hades getting jelous I just loved those glances they give each other like trying to understand the conection they are feeling So new and exiting SOOO cant not wait another week for a new episode Damn cliffhangers more,oh my gods that wait a second shiiiiit shit shit shit had me laughing sooo bad and at the same time so awwww he is worried about her cerberus face when she scratches his chin lets just say i can see hades getting jelous i just loved those glances they give each other like trying to understand the conection they are feeling so new and exiting sooo cant not wait another week for a new episode damn cliffhangers more,"['oh', 'my', 'gods', 'that', 'wait', 'a', 'second', 'shiiiiit', 'shit', 'shit', 'shit', 'had', 'me', 'laughing', 'sooo', 'bad', 'and', 'at', 'the', 'same', 'time', 'so', 'awwww', 'he', 'is', 'worried', 'about', 'her', 'cerberus', 'face', 'when', 'she', 'scratches', 'his', 'chin', 'lets', 'just', 'say', 'i', 'can', 'see', 'hades', 'getting', 'jelous', 'i', 'just', 'loved', 'those', 'glances', 'they', 'give', 'each', 'other', 'like', 'trying', 'to', 'understand', 'the', 'conection', 'they', 'are', 'feeling', 'so', 'new', 'and', 'exiting', 'sooo', 'cant', 'not', 'wait', 'another', 'week', 'for', 'a', 'new', 'episode', 'damn', 'cliffhangers', 'more']",oh gods wait second shiiiiit shit shit shit laughing sooo bad time awwww worried cerberus face scratches chin lets say see hades getting jelous loved glances give like trying understand conection feeling new exiting sooo cant wait another week new episode damn cliffhangers,oh gods wait second shiiiiit shit shit shit laughing sooo bad time awwww worried cerberus face scratches chin lets say see hades getting jelous loved glances give like trying understand conection feeling new exiting sooo cant wait another week new episode damn cliffhang,-0.8442,neg
"Apr 01, 2018",“I would pay you a salary to barge in on every single aspect of my life” MY HEARTTTTT IM DEAD❤️❤️❤️❤️❤️❤️ Edit: THANK YOU GUYS FOR TOP COMMENT AND THANK YOU AUTHOR FOR COMING UP WITH SUCH SMOOTH LINES ❤️,147762,511,“I would pay you a salary to barge in on every single aspect of my life” MY HEARTTTTT IM DEAD️️️️️️ Edit THANK YOU GUYS FOR TOP COMMENT AND THANK YOU AUTHOR FOR COMING UP WITH SUCH SMOOTH LINES ️,“i would pay you a salary to barge in on every single aspect of my life” my hearttttt im dead️️️️️️ edit thank you guys for top comment and thank you author for coming up with such smooth lines ️,"['“', 'i', 'would', 'pay', 'you', 'a', 'salary', 'to', 'barge', 'in', 'on', 'every', 'single', 'aspect', 'of', 'my', 'life', '”', 'my', 'hearttttt', 'im', 'dead️️️️️️', 'edit', 'thank', 'you', 'guys', 'for', 'top', 'comment', 'and', 'thank', 'you', 'author', 'for', 'coming', 'up', 'with', 'such', 'smooth', 'lines', '️']",“ would pay salary barge every single aspect life ” hearttttt im dead️️️️️️ edit thank guys top comment thank author coming smooth lines ️,“ would pay salary barge every single aspect life ” hearttttt im dead️️️️️️ edit thank guys top comment thank author coming smooth lines ️,0.6597,pos
"Apr 01, 2018","Hang on, “Kore” was actually Persephone‘s name in the original mythology (it was changed to “Persephone” by Zeus)... THE AUTHOR DID SOME SERIOUS FREAKING RESEARCH *ROUND OF APPLAUSE* 👏👏👏",122544,374,Hang on “Kore” was actually Persephone‘s name in the original mythology it was changed to “Persephone” by Zeus THE AUTHOR DID SOME SERIOUS FREAKING RESEARCH ROUND OF APPLAUSE ,hang on “kore” was actually persephone‘s name in the original mythology it was changed to “persephone” by zeus the author did some serious freaking research round of applause ,"['hang', 'on', '“', 'kore', '”', 'was', 'actually', 'persephone', '‘', 's', 'name', 'in', 'the', 'original', 'mythology', 'it', 'was', 'changed', 'to', '“', 'persephone', '”', 'by', 'zeus', 'the', 'author', 'did', 'some', 'serious', 'freaking', 'research', 'round', 'of', 'applause']",hang “ kore ” actually persephone ‘ name original mythology changed “ persephone ” zeus author serious freaking research round applause,hang “ kore ” actually persephone ‘ name original mythology changed “ persephone ” zeus author serious freaking research round applaus,-0.2023,neg
"Apr 01, 2018",HE THOUGHT THEY WERE GONNA FUCK IN THE KITCHEN OOOOOHH HE A HOE,45918,189,HE THOUGHT THEY WERE GONNA FUCK IN THE KITCHEN OOOOOHH HE A HOE,he thought they were gonna fuck in the kitchen ooooohh he a hoe,"['he', 'thought', 'they', 'were', 'gon', 'na', 'fuck', 'in', 'the', 'kitchen', 'ooooohh', 'he', 'a', 'hoe']",thought gon na fuck kitchen ooooohh hoe,thought gon na fuck kitchen ooooohh ho,-0.5423,neg
"Apr 01, 2018","The devil might be a handsome man, but Hades is a hot God. 😂😂",2518,13,The devil might be a handsome man but Hades is a hot God ,the devil might be a handsome man but hades is a hot god ,"['the', 'devil', 'might', 'be', 'a', 'handsome', 'man', 'but', 'hades', 'is', 'a', 'hot', 'god']",devil might handsome man hades hot god,devil might handsome man hades hot god,-0.0258,neu
"Apr 01, 2018",Persephone Persephone throw me down your hair products!,2302,3,Persephone Persephone throw me down your hair products,persephone persephone throw me down your hair products,"['persephone', 'persephone', 'throw', 'me', 'down', 'your', 'hair', 'products']",persephone persephone throw hair products,persephone persephone throw hair product,0.0,neu
"Apr 01, 2018",This Minthe girl is gonna be the death of our ship I can sense it. Every pirate senses it,1729,8,This Minthe girl is gonna be the death of our ship I can sense it Every pirate senses it,this minthe girl is gonna be the death of our ship i can sense it every pirate senses it,"['this', 'minthe', 'girl', 'is', 'gon', 'na', 'be', 'the', 'death', 'of', 'our', 'ship', 'i', 'can', 'sense', 'it', 'every', 'pirate', 'senses', 'it']",minthe girl gon na death ship sense every pirate senses,minthe girl gon na death ship sense every pirate sens,-0.5994,neg
"Apr 01, 2018",IM HITTING THE GROUND WUTH MY HANDS AND ITS NOT WORKING,1600,5,IM HITTING THE GROUND WUTH MY HANDS AND ITS NOT WORKING,im hitting the ground wuth my hands and its not working,"['im', 'hitting', 'the', 'ground', 'wuth', 'my', 'hands', 'and', 'its', 'not', 'working']",im hitting ground wuth hands working,im hitting ground wuth hands work,0.0,neu
"Apr 01, 2018","""My brothers aren't even here, and they are ruining this for me""- siblings in a nutshell",1235,0,My brothers aren t even here and they are ruining this for me siblings in a nutshell,my brothers aren t even here and they are ruining this for me siblings in a nutshell,"['my', 'brothers', 'aren', 't', 'even', 'here', 'and', 'they', 'are', 'ruining', 'this', 'for', 'me', 'siblings', 'in', 'a', 'nutshell']",brothers even ruining siblings nutshell,brothers even ruining siblings nutshel,-0.25,neg
"Apr 01, 2018",I wish I could be as accidentally sexy as Persephone,1180,6,I wish I could be as accidentally sexy as Persephone,i wish i could be as accidentally sexy as persephone,"['i', 'wish', 'i', 'could', 'be', 'as', 'accidentally', 'sexy', 'as', 'persephone']",wish could accidentally sexy persephone,wish could accidentally sexy persephon,0.5719,pos
"Apr 01, 2018","OOOH HADES YOU WERE READY TO DO THE DIRTY YOU SLY DOG! - wait that's a lie, your dog is tamer than you!!  *WE're wAtCHinG Youuuu*",854,2,OOOH HADES YOU WERE READY TO DO THE DIRTY YOU SLY DOG wait that s a lie your dog is tamer than you WE re wAtCHinG Youuuu,oooh hades you were ready to do the dirty you sly dog wait that s a lie your dog is tamer than you we re watching youuuu,"['oooh', 'hades', 'you', 'were', 'ready', 'to', 'do', 'the', 'dirty', 'you', 'sly', 'dog', 'wait', 'that', 's', 'a', 'lie', 'your', 'dog', 'is', 'tamer', 'than', 'you', 'we', 're', 'watching', 'youuuu']",oooh hades ready dirty sly dog wait lie dog tamer watching youuuu,oooh hades ready dirty sly dog wait lie dog tamer watching youuuu,-0.1027,neg
