Date,Comment,Like,Dislike,Clean_comment,Comment_Lower,Summary_Tokenized,Comment_no_stopwords,Comments_stem,Sentiment score,Sentiment category
"Mar 04, 2018",I like how Aphrodite and her son casually talk about polos and orgies lmao I love this comic,38747,89,I like how Aphrodite and her son casually talk about polos and orgies lmao I love this comic,i like how aphrodite and her son casually talk about polos and orgies lmao i love this comic,"['i', 'like', 'how', 'aphrodite', 'and', 'her', 'son', 'casually', 'talk', 'about', 'polos', 'and', 'orgies', 'lmao', 'i', 'love', 'this', 'comic']",like aphrodite son casually talk polos orgies lmao love comic,like aphrodite son casually talk polos orgies lmao love com,0.9062,pos
"Mar 04, 2018",OH MY GOD. IT'S HERE. ITS FEATURED. AMAZING,38746,545,OH MY GOD IT S HERE ITS FEATURED AMAZING,oh my god it s here its featured amazing,"['oh', 'my', 'god', 'it', 's', 'here', 'its', 'featured', 'amazing']",oh god featured amazing,oh god featured amaz,0.2732,pos
"Mar 04, 2018",Their mother son dynamic is something I both love and hate,2029,4,Their mother son dynamic is something I both love and hate,their mother son dynamic is something i both love and hate,"['their', 'mother', 'son', 'dynamic', 'is', 'something', 'i', 'both', 'love', 'and', 'hate']",mother son dynamic something love hate,mother son dynamic something love h,0.7783,pos
"Mar 04, 2018",Eros is out here coordinating orgies and I can't even get a date,1698,4,Eros is out here coordinating orgies and I can t even get a date,eros is out here coordinating orgies and i can t even get a date,"['eros', 'is', 'out', 'here', 'coordinating', 'orgies', 'and', 'i', 'can', 't', 'even', 'get', 'a', 'date']",eros coordinating orgies even get date,eros coordinating orgies even get d,0.0,neu
"Mar 04, 2018",He puts his glasses on because persephone's beauty is making him go blind,1353,2,He puts his glasses on because persephone s beauty is making him go blind,he puts his glasses on because persephone s beauty is making him go blind,"['he', 'puts', 'his', 'glasses', 'on', 'because', 'persephone', 's', 'beauty', 'is', 'making', 'him', 'go', 'blind']",puts glasses persephone beauty making go blind,puts glasses persephone beauty making go blind,0.2732,pos
"Mar 04, 2018",Greek myth has several love stories gone wrong because someone said they looked better than Aphrodite. shes sensitive to that 😂😂😂. and I like how Zeus hasnt given the real reason or at least the reason agmccording to myth with demeter hates his guts,1114,2,Greek myth has several love stories gone wrong because someone said they looked better than Aphrodite shes sensitive to that  and I like how Zeus hasnt given the real reason or at least the reason agmccording to myth with demeter hates his guts,greek myth has several love stories gone wrong because someone said they looked better than aphrodite shes sensitive to that  and i like how zeus hasnt given the real reason or at least the reason agmccording to myth with demeter hates his guts,"['greek', 'myth', 'has', 'several', 'love', 'stories', 'gone', 'wrong', 'because', 'someone', 'said', 'they', 'looked', 'better', 'than', 'aphrodite', 'shes', 'sensitive', 'to', 'that', 'and', 'i', 'like', 'how', 'zeus', 'hasnt', 'given', 'the', 'real', 'reason', 'or', 'at', 'least', 'the', 'reason', 'agmccording', 'to', 'myth', 'with', 'demeter', 'hates', 'his', 'guts']",greek myth several love stories gone wrong someone said looked better aphrodite shes sensitive like zeus hasnt given real reason least reason agmccording myth demeter hates guts,greek myth several love stories gone wrong someone said looked better aphrodite shes sensitive like zeus hasnt given real reason least reason agmccording myth demeter hates gut,0.5574,pos
"Mar 04, 2018",Aphrodite’s reaction is 100% accurate to the myths. XD She’s probably plotting Persephone’s murder right now.,875,1,Aphrodite’s reaction is 100 accurate to the myths XD She’s probably plotting Persephone’s murder right now,aphrodite’s reaction is 100 accurate to the myths xd she’s probably plotting persephone’s murder right now,"['aphrodite', '’', 's', 'reaction', 'is', '100', 'accurate', 'to', 'the', 'myths', 'xd', 'she', '’', 's', 'probably', 'plotting', 'persephone', '’', 's', 'murder', 'right', 'now']",aphrodite ’ reaction 100 accurate myths xd ’ probably plotting persephone ’ murder right,aphrodite ’ reaction 100 accurate myths xd ’ probably plotting persephone ’ murder right,-0.2263,neg
"Mar 06, 2018",When Zeus says he’s “morally corrupt” he totally is. You have any idea how many woman he’s technically raped? A woman even turned herself into a bush to get away from him. Juuusst sayin.,773,1,When Zeus says he’s “morally corrupt” he totally is You have any idea how many woman he’s technically raped A woman even turned herself into a bush to get away from him Juuusst sayin,when zeus says he’s “morally corrupt” he totally is you have any idea how many woman he’s technically raped a woman even turned herself into a bush to get away from him juuusst sayin,"['when', 'zeus', 'says', 'he', '’', 's', '“', 'morally', 'corrupt', '”', 'he', 'totally', 'is', 'you', 'have', 'any', 'idea', 'how', 'many', 'woman', 'he', '’', 's', 'technically', 'raped', 'a', 'woman', 'even', 'turned', 'herself', 'into', 'a', 'bush', 'to', 'get', 'away', 'from', 'him', 'juuusst', 'sayin']",zeus says ’ “ morally corrupt ” totally idea many woman ’ technically raped woman even turned bush get away juuusst sayin,zeus says ’ “ morally corrupt ” totally idea many woman ’ technically raped woman even turned bush get away juuusst sayin,-0.6808,neg
"Mar 05, 2018","I just know Aphrodite's gonna be petty, I can feel it in my psyche.",561,3,I just know Aphrodite s gonna be petty I can feel it in my psyche,i just know aphrodite s gonna be petty i can feel it in my psyche,"['i', 'just', 'know', 'aphrodite', 's', 'gon', 'na', 'be', 'petty', 'i', 'can', 'feel', 'it', 'in', 'my', 'psyche']",know aphrodite gon na petty feel psyche,know aphrodite gon na petty feel psych,-0.2023,neg
"Mar 19, 2018","Zeus said ""it's complicated"" because Persephone is his freaking DAUGHTER",429,4,Zeus said it s complicated because Persephone is his freaking DAUGHTER,zeus said it s complicated because persephone is his freaking daughter,"['zeus', 'said', 'it', 's', 'complicated', 'because', 'persephone', 'is', 'his', 'freaking', 'daughter']",zeus said complicated persephone freaking daughter,zeus said complicated persephone freaking daught,-0.4215,neg
"Mar 05, 2018","Hades: Honestly, I think she puts Aphrodite to shame! Aphrodite: TRIGGERED",339,1,Hades Honestly I think she puts Aphrodite to shame Aphrodite TRIGGERED,hades honestly i think she puts aphrodite to shame aphrodite triggered,"['hades', 'honestly', 'i', 'think', 'she', 'puts', 'aphrodite', 'to', 'shame', 'aphrodite', 'triggered']",hades honestly think puts aphrodite shame aphrodite triggered,hades honestly think puts aphrodite shame aphrodite trigg,-0.0258,neu
"Mar 04, 2018","""I DO NOT CARE ABOUT DEMETER'S  TAXES!""  Like if you get it 😉",214,0,I DO NOT CARE ABOUT DEMETER S TAXES Like if you get it ,i do not care about demeter s taxes like if you get it ,"['i', 'do', 'not', 'care', 'about', 'demeter', 's', 'taxes', 'like', 'if', 'you', 'get', 'it']",care demeter taxes like get,care demeter taxes like get,0.6908,pos
"Mar 04, 2018","""This orgy isn't gonna run itself"" oh my gawd...I'm dying hahahahaha",206,0,This orgy isn t gonna run itself oh my gawd I m dying hahahahaha,this orgy isn t gonna run itself oh my gawd i m dying hahahahaha,"['this', 'orgy', 'isn', 't', 'gon', 'na', 'run', 'itself', 'oh', 'my', 'gawd', 'i', 'm', 'dying', 'hahahahaha']",orgy gon na run oh gawd dying hahahahaha,orgy gon na run oh gawd dying hahahahaha,0.0,neu
"Mar 04, 2018",I'M SCREAMING AT THE 'SHORT SIGHTED' ME TOO HADES,165,0,I M SCREAMING AT THE SHORT SIGHTED ME TOO HADES,i m screaming at the short sighted me too hades,"['i', 'm', 'screaming', 'at', 'the', 'short', 'sighted', 'me', 'too', 'hades']",screaming short sighted hades,screaming short sighted had,-0.3818,neg
"Mar 18, 2018","Hades should have worn those glasses from the start. I like how Zeus and Poseidon are both like ""Finally, something that got that dead, cold heart of his beating."" =u=",128,1,Hades should have worn those glasses from the start I like how Zeus and Poseidon are both like Finally something that got that dead cold heart of his beating u,hades should have worn those glasses from the start i like how zeus and poseidon are both like finally something that got that dead cold heart of his beating u,"['hades', 'should', 'have', 'worn', 'those', 'glasses', 'from', 'the', 'start', 'i', 'like', 'how', 'zeus', 'and', 'poseidon', 'are', 'both', 'like', 'finally', 'something', 'that', 'got', 'that', 'dead', 'cold', 'heart', 'of', 'his', 'beating', 'u']",hades worn glasses start like zeus poseidon like finally something got dead cold heart beating u,hades worn glasses start like zeus poseidon like finally something got dead cold heart beating u,-0.0772,neg
"Mar 04, 2018",anyone else remeber the orginal scene of Aphrodite getting mad?,116,1,anyone else remeber the orginal scene of Aphrodite getting mad,anyone else remeber the orginal scene of aphrodite getting mad,"['anyone', 'else', 'remeber', 'the', 'orginal', 'scene', 'of', 'aphrodite', 'getting', 'mad']",anyone else remeber orginal scene aphrodite getting mad,anyone else remeber orginal scene aphrodite getting mad,-0.4939,neg
"Mar 05, 2018","BTW people... the reason why the situation is ""complicated"" is because not only is Zeus Demeter's brother, but also the father of her daughter, Persephone. LOL",117,4,BTW people the reason why the situation is complicated is because not only is Zeus Demeter s brother but also the father of her daughter Persephone LOL,btw people the reason why the situation is complicated is because not only is zeus demeter s brother but also the father of her daughter persephone lol,"['btw', 'people', 'the', 'reason', 'why', 'the', 'situation', 'is', 'complicated', 'is', 'because', 'not', 'only', 'is', 'zeus', 'demeter', 's', 'brother', 'but', 'also', 'the', 'father', 'of', 'her', 'daughter', 'persephone', 'lol']",btw people reason situation complicated zeus demeter brother also father daughter persephone lol,btw people reason situation complicated zeus demeter brother also father daughter persephone lol,0.4215,pos
"Mar 04, 2018","Does the Dicovery Squad remember how originally Hades said ""She's more beautiful that Aphrodite"" and then it zoomed into Aphrodites face while she was walking",106,3,Does the Dicovery Squad remember how originally Hades said She s more beautiful that Aphrodite and then it zoomed into Aphrodites face while she was walking,does the dicovery squad remember how originally hades said she s more beautiful that aphrodite and then it zoomed into aphrodites face while she was walking,"['does', 'the', 'dicovery', 'squad', 'remember', 'how', 'originally', 'hades', 'said', 'she', 's', 'more', 'beautiful', 'that', 'aphrodite', 'and', 'then', 'it', 'zoomed', 'into', 'aphrodites', 'face', 'while', 'she', 'was', 'walking']",dicovery squad remember originally hades said beautiful aphrodite zoomed aphrodites face walking,dicovery squad remember originally hades said beautiful aphrodite zoomed aphrodites face walk,0.5994,pos
"Mar 04, 2018","DAMN IT MUM, THIS ORGY WON'T RUN ITSELF",84,0,DAMN IT MUM THIS ORGY WON T RUN ITSELF,damn it mum this orgy won t run itself,"['damn', 'it', 'mum', 'this', 'orgy', 'won', 't', 'run', 'itself']",damn mum orgy run,damn mum orgy run,-0.4019,neg
"Jul 20, 2018","So, Zeus, Poseidon, Hades, Hera, Demeter and Hestia are siblings. Zeus married Hera. Persephone is daughter of Zeus and Demeter. Hades marries Persephone who is his niece. I swear, this gods are worser than Lanisters",80,3,So Zeus Poseidon Hades Hera Demeter and Hestia are siblings Zeus married Hera Persephone is daughter of Zeus and Demeter Hades marries Persephone who is his niece I swear this gods are worser than Lanisters,so zeus poseidon hades hera demeter and hestia are siblings zeus married hera persephone is daughter of zeus and demeter hades marries persephone who is his niece i swear this gods are worser than lanisters,"['so', 'zeus', 'poseidon', 'hades', 'hera', 'demeter', 'and', 'hestia', 'are', 'siblings', 'zeus', 'married', 'hera', 'persephone', 'is', 'daughter', 'of', 'zeus', 'and', 'demeter', 'hades', 'marries', 'persephone', 'who', 'is', 'his', 'niece', 'i', 'swear', 'this', 'gods', 'are', 'worser', 'than', 'lanisters']",zeus poseidon hades hera demeter hestia siblings zeus married hera persephone daughter zeus demeter hades marries persephone niece swear gods worser lanisters,zeus poseidon hades hera demeter hestia siblings zeus married hera persephone daughter zeus demeter hades marries persephone niece swear gods worser lanist,-0.4939,neg
"Mar 04, 2018",Well aren't Aphrodite and her son close?😂,67,0,Well aren t Aphrodite and her son close ,well aren t aphrodite and her son close ,"['well', 'aren', 't', 'aphrodite', 'and', 'her', 'son', 'close']",well aphrodite son close,well aphrodite son clos,0.2732,pos
"Mar 04, 2018",So invested in their relationship already and they.. haven't even spoken. 😂😍 Hopefully she remembers what happened! (did he bring her to his house because she felt uncomfortable/Eros drugged her?),60725,382,So invested in their relationship already and they haven t even spoken  Hopefully she remembers what happened did he bring her to his house because she felt uncomfortable Eros drugged her,so invested in their relationship already and they haven t even spoken  hopefully she remembers what happened did he bring her to his house because she felt uncomfortable eros drugged her,"['so', 'invested', 'in', 'their', 'relationship', 'already', 'and', 'they', 'haven', 't', 'even', 'spoken', 'hopefully', 'she', 'remembers', 'what', 'happened', 'did', 'he', 'bring', 'her', 'to', 'his', 'house', 'because', 'she', 'felt', 'uncomfortable', 'eros', 'drugged', 'her']",invested relationship already even spoken hopefully remembers happened bring house felt uncomfortable eros drugged,invested relationship already even spoken hopefully remembers happened bring house felt uncomfortable eros drug,0.0258,neu
"Mar 04, 2018",Your hard work has definitely paid off!! All the rework has added so much valuable information about their first meeting and the dynamic of everyone on Olympus. I'm so happy to finally see you on Discover and so glad everyone else gets to know about this great story!!!,35045,411,Your hard work has definitely paid off All the rework has added so much valuable information about their first meeting and the dynamic of everyone on Olympus I m so happy to finally see you on Discover and so glad everyone else gets to know about this great story,your hard work has definitely paid off all the rework has added so much valuable information about their first meeting and the dynamic of everyone on olympus i m so happy to finally see you on discover and so glad everyone else gets to know about this great story,"['your', 'hard', 'work', 'has', 'definitely', 'paid', 'off', 'all', 'the', 'rework', 'has', 'added', 'so', 'much', 'valuable', 'information', 'about', 'their', 'first', 'meeting', 'and', 'the', 'dynamic', 'of', 'everyone', 'on', 'olympus', 'i', 'm', 'so', 'happy', 'to', 'finally', 'see', 'you', 'on', 'discover', 'and', 'so', 'glad', 'everyone', 'else', 'gets', 'to', 'know', 'about', 'this', 'great', 'story']",hard work definitely paid rework added much valuable information first meeting dynamic everyone olympus happy finally see discover glad everyone else gets know great story,hard work definitely paid rework added much valuable information first meeting dynamic everyone olympus happy finally see discover glad everyone else gets know great stori,0.9571,pos
"Mar 04, 2018",I would feel so much better if I didn't see people flooding the first several episodes flooded with Discover comments. Yes you want to find people who were there with you while it was still in Discover but does it have to conquer all the top comments in all the recently released episodes? Sometimes newbies to the series just want to see comments related to the episode up there for once!,15174,220,I would feel so much better if I didn t see people flooding the first several episodes flooded with Discover comments Yes you want to find people who were there with you while it was still in Discover but does it have to conquer all the top comments in all the recently released episodes Sometimes newbies to the series just want to see comments related to the episode up there for once,i would feel so much better if i didn t see people flooding the first several episodes flooded with discover comments yes you want to find people who were there with you while it was still in discover but does it have to conquer all the top comments in all the recently released episodes sometimes newbies to the series just want to see comments related to the episode up there for once,"['i', 'would', 'feel', 'so', 'much', 'better', 'if', 'i', 'didn', 't', 'see', 'people', 'flooding', 'the', 'first', 'several', 'episodes', 'flooded', 'with', 'discover', 'comments', 'yes', 'you', 'want', 'to', 'find', 'people', 'who', 'were', 'there', 'with', 'you', 'while', 'it', 'was', 'still', 'in', 'discover', 'but', 'does', 'it', 'have', 'to', 'conquer', 'all', 'the', 'top', 'comments', 'in', 'all', 'the', 'recently', 'released', 'episodes', 'sometimes', 'newbies', 'to', 'the', 'series', 'just', 'want', 'to', 'see', 'comments', 'related', 'to', 'the', 'episode', 'up', 'there', 'for', 'once']",would feel much better see people flooding first several episodes flooded discover comments yes want find people still discover conquer top comments recently released episodes sometimes newbies series want see comments related episode,would feel much better see people flooding first several episodes flooded discover comments yes want find people still discover conquer top comments recently released episodes sometimes newbies series want see comments related episod,0.7906,pos
"Mar 04, 2018",Hold up. Didnt she JUST have a pixie cut? How long has she been there her hair is like goddamn rapunzel! Demeter is going to be PISSED!,1681,8,Hold up Didnt she JUST have a pixie cut How long has she been there her hair is like goddamn rapunzel Demeter is going to be PISSED,hold up didnt she just have a pixie cut how long has she been there her hair is like goddamn rapunzel demeter is going to be pissed,"['hold', 'up', 'didnt', 'she', 'just', 'have', 'a', 'pixie', 'cut', 'how', 'long', 'has', 'she', 'been', 'there', 'her', 'hair', 'is', 'like', 'goddamn', 'rapunzel', 'demeter', 'is', 'going', 'to', 'be', 'pissed']",hold didnt pixie cut long hair like goddamn rapunzel demeter going pissed,hold didnt pixie cut long hair like goddamn rapunzel demeter going piss,-0.3582,neg
"Mar 05, 2018","True Hades is depicted as kidnapping Persephone, but maybe that’s what Aphrodite want everyone to think...to ruin Hades’s prospects with Persephone. That looks like Hades’s bed, seeing the 3 headed dog in the background. Persephone will most likely come to the conclusion that Hades brought her there and raped her, this souring their relationship. Just a theory though",830,5,True Hades is depicted as kidnapping Persephone but maybe that’s what Aphrodite want everyone to think to ruin Hades’s prospects with Persephone That looks like Hades’s bed seeing the 3 headed dog in the background Persephone will most likely come to the conclusion that Hades brought her there and raped her this souring their relationship Just a theory though,true hades is depicted as kidnapping persephone but maybe that’s what aphrodite want everyone to think to ruin hades’s prospects with persephone that looks like hades’s bed seeing the 3 headed dog in the background persephone will most likely come to the conclusion that hades brought her there and raped her this souring their relationship just a theory though,"['true', 'hades', 'is', 'depicted', 'as', 'kidnapping', 'persephone', 'but', 'maybe', 'that', '’', 's', 'what', 'aphrodite', 'want', 'everyone', 'to', 'think', 'to', 'ruin', 'hades', '’', 's', 'prospects', 'with', 'persephone', 'that', 'looks', 'like', 'hades', '’', 's', 'bed', 'seeing', 'the', '3', 'headed', 'dog', 'in', 'the', 'background', 'persephone', 'will', 'most', 'likely', 'come', 'to', 'the', 'conclusion', 'that', 'hades', 'brought', 'her', 'there', 'and', 'raped', 'her', 'this', 'souring', 'their', 'relationship', 'just', 'a', 'theory', 'though']",true hades depicted kidnapping persephone maybe ’ aphrodite want everyone think ruin hades ’ prospects persephone looks like hades ’ bed seeing 3 headed dog background persephone likely come conclusion hades brought raped souring relationship theory though,true hades depicted kidnapping persephone maybe ’ aphrodite want everyone think ruin hades ’ prospects persephone looks like hades ’ bed seeing 3 headed dog background persephone likely come conclusion hades brought raped souring relationship theory though,-0.3818,neg
"Jan 18, 2019","*Too bad Artemis hates you*-to be fair, Artemis hates pretty much everyone, especially if they have a dick...",355,2,Too bad Artemis hates you to be fair Artemis hates pretty much everyone especially if they have a dick,too bad artemis hates you to be fair artemis hates pretty much everyone especially if they have a dick,"['too', 'bad', 'artemis', 'hates', 'you', 'to', 'be', 'fair', 'artemis', 'hates', 'pretty', 'much', 'everyone', 'especially', 'if', 'they', 'have', 'a', 'dick']",bad artemis hates fair artemis hates pretty much everyone especially dick,bad artemis hates fair artemis hates pretty much everyone especially dick,-0.8122,neg
"Mar 04, 2018",anyone else loves how the author changed the story a bit,346,6,anyone else loves how the author changed the story a bit,anyone else loves how the author changed the story a bit,"['anyone', 'else', 'loves', 'how', 'the', 'author', 'changed', 'the', 'story', 'a', 'bit']",anyone else loves author changed story bit,anyone else loves author changed story bit,0.5719,pos
"Mar 04, 2018",I must say this rendition of greek mythos is very nicely adapted to modern times. You still get the core concept of the tale aswell. I applaud you author-sama.,319,4,I must say this rendition of greek mythos is very nicely adapted to modern times You still get the core concept of the tale aswell I applaud you author sama,i must say this rendition of greek mythos is very nicely adapted to modern times you still get the core concept of the tale aswell i applaud you author sama,"['i', 'must', 'say', 'this', 'rendition', 'of', 'greek', 'mythos', 'is', 'very', 'nicely', 'adapted', 'to', 'modern', 'times', 'you', 'still', 'get', 'the', 'core', 'concept', 'of', 'the', 'tale', 'aswell', 'i', 'applaud', 'you', 'author', 'sama']",must say rendition greek mythos nicely adapted modern times still get core concept tale aswell applaud author sama,must say rendition greek mythos nicely adapted modern times still get core concept tale aswell applaud author sama,0.7096,pos
"Mar 04, 2018",Eros looks like the white boy in a cul de sac,260,4,Eros looks like the white boy in a cul de sac,eros looks like the white boy in a cul de sac,"['eros', 'looks', 'like', 'the', 'white', 'boy', 'in', 'a', 'cul', 'de', 'sac']",eros looks like white boy cul de sac,eros looks like white boy cul de sac,0.3612,pos
"Jul 18, 2018",We got Eros over here looking like a basic white boy,223,3,We got Eros over here looking like a basic white boy,we got eros over here looking like a basic white boy,"['we', 'got', 'eros', 'over', 'here', 'looking', 'like', 'a', 'basic', 'white', 'boy']",got eros looking like basic white boy,got eros looking like basic white boy,0.3612,pos
"Sep 30, 2018","Wow. Has anyone else noticed how cute Hades is with glasses? Also I aready love the brothers. Posiden is the cute dummy, Zeus is the sly smooth talker and Hades is the loner.",168,0,Wow Has anyone else noticed how cute Hades is with glasses Also I aready love the brothers Posiden is the cute dummy Zeus is the sly smooth talker and Hades is the loner,wow has anyone else noticed how cute hades is with glasses also i aready love the brothers posiden is the cute dummy zeus is the sly smooth talker and hades is the loner,"['wow', 'has', 'anyone', 'else', 'noticed', 'how', 'cute', 'hades', 'is', 'with', 'glasses', 'also', 'i', 'aready', 'love', 'the', 'brothers', 'posiden', 'is', 'the', 'cute', 'dummy', 'zeus', 'is', 'the', 'sly', 'smooth', 'talker', 'and', 'hades', 'is', 'the', 'loner']",wow anyone else noticed cute hades glasses also aready love brothers posiden cute dummy zeus sly smooth talker hades loner,wow anyone else noticed cute hades glasses also aready love brothers posiden cute dummy zeus sly smooth talker hades lon,0.9325,pos
"Mar 29, 2018",Poseidon casually sipping his beer while Hades oozes angst beside him is a mood tbh,145,1,Poseidon casually sipping his beer while Hades oozes angst beside him is a mood tbh,poseidon casually sipping his beer while hades oozes angst beside him is a mood tbh,"['poseidon', 'casually', 'sipping', 'his', 'beer', 'while', 'hades', 'oozes', 'angst', 'beside', 'him', 'is', 'a', 'mood', 'tbh']",poseidon casually sipping beer hades oozes angst beside mood tbh,poseidon casually sipping beer hades oozes angst beside mood tbh,0.1779,pos
