Date,Comment,Like,Dislike,Clean_comment,Comment_Lower,Summary_Tokenized,Comment_no_stopwords,Comments_stem,Sentiment score,Sentiment category
"Mar 04, 2018",EYYY ANYONE HERE FROM DISCOVER??? I LOVE THIS SM HOPE YOU NEWCOMERS ENJOY!!,57463,904,EYYY ANYONE HERE FROM DISCOVER I LOVE THIS SM HOPE YOU NEWCOMERS ENJOY,eyyy anyone here from discover i love this sm hope you newcomers enjoy,"['eyyy', 'anyone', 'here', 'from', 'discover', 'i', 'love', 'this', 'sm', 'hope', 'you', 'newcomers', 'enjoy']",eyyy anyone discover love sm hope newcomers enjoy,eyyy anyone discover love sm hope newcomers enjoy,0.8834,pos
"Mar 04, 2018","The art style is mesmerizing! Can't wait to see where this goes, this myth has always fascinated me~ [+please like the chapters to support the author/boost it in the charts!]",54296,674,The art style is mesmerizing Can t wait to see where this goes this myth has always fascinated me please like the chapters to support the author boost it in the charts,the art style is mesmerizing can t wait to see where this goes this myth has always fascinated me please like the chapters to support the author boost it in the charts,"['the', 'art', 'style', 'is', 'mesmerizing', 'can', 't', 'wait', 'to', 'see', 'where', 'this', 'goes', 'this', 'myth', 'has', 'always', 'fascinated', 'me', 'please', 'like', 'the', 'chapters', 'to', 'support', 'the', 'author', 'boost', 'it', 'in', 'the', 'charts']",art style mesmerizing wait see goes myth always fascinated please like chapters support author boost charts,art style mesmerizing wait see goes myth always fascinated please like chapters support author boost chart,0.9062,pos
"Mar 04, 2018",I'm from discover too.EDIT: I can't believe I got top comment this has never happened to me. So I guess id just like to say thank you for liking my comment. I love this myth and I can't wait to see the authors interpretation of this story come about😀💖🖤,30913,1263,I m from discover too EDIT I can t believe I got top comment this has never happened to me So I guess id just like to say thank you for liking my comment I love this myth and I can t wait to see the authors interpretation of this story come about,i m from discover too edit i can t believe i got top comment this has never happened to me so i guess id just like to say thank you for liking my comment i love this myth and i can t wait to see the authors interpretation of this story come about,"['i', 'm', 'from', 'discover', 'too', 'edit', 'i', 'can', 't', 'believe', 'i', 'got', 'top', 'comment', 'this', 'has', 'never', 'happened', 'to', 'me', 'so', 'i', 'guess', 'id', 'just', 'like', 'to', 'say', 'thank', 'you', 'for', 'liking', 'my', 'comment', 'i', 'love', 'this', 'myth', 'and', 'i', 'can', 't', 'wait', 'to', 'see', 'the', 'authors', 'interpretation', 'of', 'this', 'story', 'come', 'about']",discover edit believe got top comment never happened guess id like say thank liking comment love myth wait see authors interpretation story come,discover edit believe got top comment never happened guess id like say thank liking comment love myth wait see authors interpretation story com,0.9136,pos
"Mar 04, 2018",HEY YEAH HI IM A GREEK NERD AND I LOVE THIS MORE THAN ZEUS LIKES TO FUCK EVERYTHING THAT MOVES KTHNXSBAI,1817,24,HEY YEAH HI IM A GREEK NERD AND I LOVE THIS MORE THAN ZEUS LIKES TO FUCK EVERYTHING THAT MOVES KTHNXSBAI,hey yeah hi im a greek nerd and i love this more than zeus likes to fuck everything that moves kthnxsbai,"['hey', 'yeah', 'hi', 'im', 'a', 'greek', 'nerd', 'and', 'i', 'love', 'this', 'more', 'than', 'zeus', 'likes', 'to', 'fuck', 'everything', 'that', 'moves', 'kthnxsbai']",hey yeah hi im greek nerd love zeus likes fuck everything moves kthnxsbai,hey yeah hi im greek nerd love zeus likes fuck everything moves kthnxsbai,0.5423,pos
"Mar 04, 2018",Hades' phone: Apple=Pomegranate lol,943,6,Hades phone Apple Pomegranate lol,hades phone apple pomegranate lol,"['hades', 'phone', 'apple', 'pomegranate', 'lol']",hades phone apple pomegranate lol,hades phone apple pomegranate lol,0.4215,pos
"Jul 01, 2018","this satisfies my inner mythology nerd in a strange way. here, have some trivia: Minthe was a naiad, a kind of nymph, connected to a river in the underworld called cocytus. She tried to seduce Hades but his wife, Persephone, turned her into a (who would've guessed) mint plant, thus giving the plant its name :)",803,6,this satisfies my inner mythology nerd in a strange way here have some trivia Minthe was a naiad a kind of nymph connected to a river in the underworld called cocytus She tried to seduce Hades but his wife Persephone turned her into a who would ve guessed mint plant thus giving the plant its name,this satisfies my inner mythology nerd in a strange way here have some trivia minthe was a naiad a kind of nymph connected to a river in the underworld called cocytus she tried to seduce hades but his wife persephone turned her into a who would ve guessed mint plant thus giving the plant its name,"['this', 'satisfies', 'my', 'inner', 'mythology', 'nerd', 'in', 'a', 'strange', 'way', 'here', 'have', 'some', 'trivia', 'minthe', 'was', 'a', 'naiad', 'a', 'kind', 'of', 'nymph', 'connected', 'to', 'a', 'river', 'in', 'the', 'underworld', 'called', 'cocytus', 'she', 'tried', 'to', 'seduce', 'hades', 'but', 'his', 'wife', 'persephone', 'turned', 'her', 'into', 'a', 'who', 'would', 've', 'guessed', 'mint', 'plant', 'thus', 'giving', 'the', 'plant', 'its', 'name']",satisfies inner mythology nerd strange way trivia minthe naiad kind nymph connected river underworld called cocytus tried seduce hades wife persephone turned would guessed mint plant thus giving plant name,satisfies inner mythology nerd strange way trivia minthe naiad kind nymph connected river underworld called cocytus tried seduce hades wife persephone turned would guessed mint plant thus giving plant nam,0.6808,pos
"Mar 04, 2018",What? Zeus actually likes Hera???,440,5,What Zeus actually likes Hera,what zeus actually likes hera,"['what', 'zeus', 'actually', 'likes', 'hera']",zeus actually likes hera,zeus actually likes hera,0.4215,pos
"Mar 06, 2018",Oh my gods! I'm a huge fan of Greek mythology and Persephone's story with Hades it's one of my favorites so I'm excited to read your version 😊,363,8,Oh my gods I m a huge fan of Greek mythology and Persephone s story with Hades it s one of my favorites so I m excited to read your version ,oh my gods i m a huge fan of greek mythology and persephone s story with hades it s one of my favorites so i m excited to read your version ,"['oh', 'my', 'gods', 'i', 'm', 'a', 'huge', 'fan', 'of', 'greek', 'mythology', 'and', 'persephone', 's', 'story', 'with', 'hades', 'it', 's', 'one', 'of', 'my', 'favorites', 'so', 'i', 'm', 'excited', 'to', 'read', 'your', 'version']",oh gods huge fan greek mythology persephone story hades one favorites excited read version,oh gods huge fan greek mythology persephone story hades one favorites excited read vers,0.8316,pos
"Mar 04, 2018",YES FINALLY IM SO HAPPY FOR YOU AUTHOR,312,7,YES FINALLY IM SO HAPPY FOR YOU AUTHOR,yes finally im so happy for you author,"['yes', 'finally', 'im', 'so', 'happy', 'for', 'you', 'author']",yes finally im happy author,yes finally im happy author,0.7506,pos
"Jul 15, 2018",Percy Jackson anyone,314,14,Percy Jackson anyone,percy jackson anyone,"['percy', 'jackson', 'anyone']",percy jackson anyone,percy jackson anyon,0.0,neu
"Aug 26, 2018",That moment when you kiss your sister in front of your brothers,248,3,That moment when you kiss your sister in front of your brothers,that moment when you kiss your sister in front of your brothers,"['that', 'moment', 'when', 'you', 'kiss', 'your', 'sister', 'in', 'front', 'of', 'your', 'brothers']",moment kiss sister front brothers,moment kiss sister front broth,0.4215,pos
"Mar 28, 2018","Love the art style, but am I the only one who thought the characters look kinda like they’re from Inside Out...? Hehe😉",169,11,Love the art style but am I the only one who thought the characters look kinda like they’re from Inside Out Hehe,love the art style but am i the only one who thought the characters look kinda like they’re from inside out hehe,"['love', 'the', 'art', 'style', 'but', 'am', 'i', 'the', 'only', 'one', 'who', 'thought', 'the', 'characters', 'look', 'kinda', 'like', 'they', '’', 're', 'from', 'inside', 'out', 'hehe']",love art style one thought characters look kinda like ’ inside hehe,love art style one thought characters look kinda like ’ inside heh,0.701,pos
"Mar 04, 2018",Aghh! It has been feautured! I saw the date so i set it on my calender so i would not forget 😋congrats! I hope your new found journey is succesful,158,4,Aghh It has been feautured I saw the date so i set it on my calender so i would not forget congrats I hope your new found journey is succesful,aghh it has been feautured i saw the date so i set it on my calender so i would not forget congrats i hope your new found journey is succesful,"['aghh', 'it', 'has', 'been', 'feautured', 'i', 'saw', 'the', 'date', 'so', 'i', 'set', 'it', 'on', 'my', 'calender', 'so', 'i', 'would', 'not', 'forget', 'congrats', 'i', 'hope', 'your', 'new', 'found', 'journey', 'is', 'succesful']",aghh feautured saw date set calender would forget congrats hope new found journey succesful,aghh feautured saw date set calender would forget congrats hope new found journey succes,0.6597,pos
"Mar 31, 2020",Anyone rereading all the episodes because their bored in quarantine? No just me? Okay then...,149,7,Anyone rereading all the episodes because their bored in quarantine No just me Okay then,anyone rereading all the episodes because their bored in quarantine no just me okay then,"['anyone', 'rereading', 'all', 'the', 'episodes', 'because', 'their', 'bored', 'in', 'quarantine', 'no', 'just', 'me', 'okay', 'then']",anyone rereading episodes bored quarantine okay,anyone rereading episodes bored quarantine okay,-0.0516,neg
"Mar 04, 2018",*Vomits Rainbow* It’s Here!,116,8,Vomits Rainbow It’s Here,vomits rainbow it’s here,"['vomits', 'rainbow', 'it', '’', 's', 'here']",vomits rainbow ’,vomits rainbow ’,0.0,neu
"May 26, 2018",when your reading Percy Jackson and then you come across this.,111,4,when your reading Percy Jackson and then you come across this,when your reading percy jackson and then you come across this,"['when', 'your', 'reading', 'percy', 'jackson', 'and', 'then', 'you', 'come', 'across', 'this']",reading percy jackson come across,reading percy jackson come across,0.0,neu
"Mar 04, 2018",OLYMPUS DISCOVER SQUAD WHERE YOU AT?!,112,14,OLYMPUS DISCOVER SQUAD WHERE YOU AT,olympus discover squad where you at,"['olympus', 'discover', 'squad', 'where', 'you', 'at']",olympus discover squad,olympus discover squad,0.0,neu
"Sep 29, 2018",I came here from Emirichuu!,100,7,I came here from Emirichuu,i came here from emirichuu,"['i', 'came', 'here', 'from', 'emirichuu']",came emirichuu,came emirichuu,0.0,neu
"Mar 04, 2018",Is it just me or did her art get BETTER?! Colors so vibrant and bold. I think she added more detail too.,92,4,Is it just me or did her art get BETTER Colors so vibrant and bold I think she added more detail too,is it just me or did her art get better colors so vibrant and bold i think she added more detail too,"['is', 'it', 'just', 'me', 'or', 'did', 'her', 'art', 'get', 'better', 'colors', 'so', 'vibrant', 'and', 'bold', 'i', 'think', 'she', 'added', 'more', 'detail', 'too']",art get better colors vibrant bold think added detail,art get better colors vibrant bold think added detail,0.836,pos
"May 08, 2020","Yo, who else is rereading for the 50th time???",78,4,Yo who else is rereading for the 50th time,yo who else is rereading for the 50th time,"['yo', 'who', 'else', 'is', 'rereading', 'for', 'the', '50th', 'time']",yo else rereading 50th time,yo else rereading 50th tim,0.0,neu
"Jul 01, 2019",anybody else re-reading while waiting for the next update,70,2,anybody else re reading while waiting for the next update,anybody else re reading while waiting for the next update,"['anybody', 'else', 're', 'reading', 'while', 'waiting', 'for', 'the', 'next', 'update']",anybody else reading waiting next update,anybody else reading waiting next upd,0.0,neu
"Mar 04, 2018","I CAN FINALLY DO THE THING ""I'm from discover!""",72,4,I CAN FINALLY DO THE THING I m from discover,i can finally do the thing i m from discover,"['i', 'can', 'finally', 'do', 'the', 'thing', 'i', 'm', 'from', 'discover']",finally thing discover,finally thing discov,0.0,neu
"Mar 04, 2018",Who came here from discover?,71,5,Who came here from discover,who came here from discover,"['who', 'came', 'here', 'from', 'discover']",came discover,came discov,0.0,neu
"Mar 04, 2018",YES MY GOD YES. MY DISCOVER BABY IS FINALLY HERE!!,54889,842,YES MY GOD YES MY DISCOVER BABY IS FINALLY HERE,yes my god yes my discover baby is finally here,"['yes', 'my', 'god', 'yes', 'my', 'discover', 'baby', 'is', 'finally', 'here']",yes god yes discover baby finally,yes god yes discover baby fin,0.7579,pos
"Mar 04, 2018",DISCOVER SQUAD ASSEMBLE,37398,1017,DISCOVER SQUAD ASSEMBLE,discover squad assemble,"['discover', 'squad', 'assemble']",discover squad assemble,discover squad assembl,0.0,neu
"Mar 04, 2018",YES YES YES YES! I'VE BEEN WAITING! WELCOME BACK!,35808,628,YES YES YES YES I VE BEEN WAITING WELCOME BACK,yes yes yes yes i ve been waiting welcome back,"['yes', 'yes', 'yes', 'yes', 'i', 've', 'been', 'waiting', 'welcome', 'back']",yes yes yes yes waiting welcome back,yes yes yes yes waiting welcome back,0.9153,pos
"Mar 04, 2018","“CAN YOU PLEASE NOT TALK ABOUT MY BALLS. OR MY ASS, FOR THAT MATTER.”—Hades. Quote of the chapter 🎉",2002,10,“CAN YOU PLEASE NOT TALK ABOUT MY BALLS OR MY ASS FOR THAT MATTER ”—Hades Quote of the chapter ,“can you please not talk about my balls or my ass for that matter ”—hades quote of the chapter ,"['“', 'can', 'you', 'please', 'not', 'talk', 'about', 'my', 'balls', 'or', 'my', 'ass', 'for', 'that', 'matter', '”', '—hades', 'quote', 'of', 'the', 'chapter']",“ please talk balls ass matter ” —hades quote chapter,“ please talk balls ass matter ” —hades quote chapt,-0.2732,neg
"Mar 04, 2018","to people that hates this myth because of kidnaping and sorts, let me say... By FAR Persephone has the most loving Husbando in all Olympus: he gave her the same level of authority as his in the underworld affairs, he NEVER cheated on her, protected her from idiots... Hades showers her with love and respect her wishes",1682,18,to people that hates this myth because of kidnaping and sorts let me say By FAR Persephone has the most loving Husbando in all Olympus he gave her the same level of authority as his in the underworld affairs he NEVER cheated on her protected her from idiots Hades showers her with love and respect her wishes,to people that hates this myth because of kidnaping and sorts let me say by far persephone has the most loving husbando in all olympus he gave her the same level of authority as his in the underworld affairs he never cheated on her protected her from idiots hades showers her with love and respect her wishes,"['to', 'people', 'that', 'hates', 'this', 'myth', 'because', 'of', 'kidnaping', 'and', 'sorts', 'let', 'me', 'say', 'by', 'far', 'persephone', 'has', 'the', 'most', 'loving', 'husbando', 'in', 'all', 'olympus', 'he', 'gave', 'her', 'the', 'same', 'level', 'of', 'authority', 'as', 'his', 'in', 'the', 'underworld', 'affairs', 'he', 'never', 'cheated', 'on', 'her', 'protected', 'her', 'from', 'idiots', 'hades', 'showers', 'her', 'with', 'love', 'and', 'respect', 'her', 'wishes']",people hates myth kidnaping sorts let say far persephone loving husbando olympus gave level authority underworld affairs never cheated protected idiots hades showers love respect wishes,people hates myth kidnaping sorts let say far persephone loving husbando olympus gave level authority underworld affairs never cheated protected idiots hades showers love respect wish,0.9117,pos
"Mar 04, 2018","""who is she?"" YOUR NIECE!",1091,21,who is she YOUR NIECE,who is she your niece,"['who', 'is', 'she', 'your', 'niece']",niece,niec,0.0,neu
"Mar 04, 2018",Only Greek mythology nerds will truly understand Poseidon's anger towards Odysseus 😂😂,891,6,Only Greek mythology nerds will truly understand Poseidon s anger towards Odysseus ,only greek mythology nerds will truly understand poseidon s anger towards odysseus ,"['only', 'greek', 'mythology', 'nerds', 'will', 'truly', 'understand', 'poseidon', 's', 'anger', 'towards', 'odysseus']",greek mythology nerds truly understand poseidon anger towards odysseus,greek mythology nerds truly understand poseidon anger towards odysseu,-0.2023,neg
"Mar 05, 2018","Persephone sweetie, that dress is just a tad...too...short...like how are you walking? 😂",755,5,Persephone sweetie that dress is just a tad too short like how are you walking ,persephone sweetie that dress is just a tad too short like how are you walking ,"['persephone', 'sweetie', 'that', 'dress', 'is', 'just', 'a', 'tad', 'too', 'short', 'like', 'how', 'are', 'you', 'walking']",persephone sweetie dress tad short like walking,persephone sweetie dress tad short like walk,0.6908,pos
"Mar 05, 2018",Aren't his balls ALWAYS blue tho?,611,5,Aren t his balls ALWAYS blue tho,aren t his balls always blue tho,"['aren', 't', 'his', 'balls', 'always', 'blue', 'tho']",balls always blue tho,balls always blue tho,0.0,neu
"Mar 04, 2018",I like her first dress choice. the gold is nice too,471,3,I like her first dress choice the gold is nice too,i like her first dress choice the gold is nice too,"['i', 'like', 'her', 'first', 'dress', 'choice', 'the', 'gold', 'is', 'nice', 'too']",like first dress choice gold nice,like first dress choice gold nic,0.3612,pos
"Mar 30, 2018",I like how Zeus and Hades are both wearing suits and Poseidon is wearing a t-shirt with a man bun drinking some beer and generally looking like he doesn't give a shit,434,4,I like how Zeus and Hades are both wearing suits and Poseidon is wearing a t shirt with a man bun drinking some beer and generally looking like he doesn t give a shit,i like how zeus and hades are both wearing suits and poseidon is wearing a t shirt with a man bun drinking some beer and generally looking like he doesn t give a shit,"['i', 'like', 'how', 'zeus', 'and', 'hades', 'are', 'both', 'wearing', 'suits', 'and', 'poseidon', 'is', 'wearing', 'a', 't', 'shirt', 'with', 'a', 'man', 'bun', 'drinking', 'some', 'beer', 'and', 'generally', 'looking', 'like', 'he', 'doesn', 't', 'give', 'a', 'shit']",like zeus hades wearing suits poseidon wearing shirt man bun drinking beer generally looking like give shit,like zeus hades wearing suits poseidon wearing shirt man bun drinking beer generally looking like give shit,0.1027,pos
"Mar 04, 2018",hades: whos she?? 😍 Zeus:my daughter 😑,373,4,hades whos she  Zeus my daughter ,hades whos she  zeus my daughter ,"['hades', 'whos', 'she', 'zeus', 'my', 'daughter']",hades whos zeus daughter,hades whos zeus daught,0.0,neu
"Mar 06, 2018","Omg the Odyssey reference. I guess Poseidon is still pretty salty about the whole ""I-killed-your-son-sorry-but-not-sorry"" thing. lol 😂 I'll leave now.",305,1,Omg the Odyssey reference I guess Poseidon is still pretty salty about the whole I killed your son sorry but not sorry thing lol  I ll leave now,omg the odyssey reference i guess poseidon is still pretty salty about the whole i killed your son sorry but not sorry thing lol  i ll leave now,"['omg', 'the', 'odyssey', 'reference', 'i', 'guess', 'poseidon', 'is', 'still', 'pretty', 'salty', 'about', 'the', 'whole', 'i', 'killed', 'your', 'son', 'sorry', 'but', 'not', 'sorry', 'thing', 'lol', 'i', 'll', 'leave', 'now']",omg odyssey reference guess poseidon still pretty salty whole killed son sorry sorry thing lol leave,omg odyssey reference guess poseidon still pretty salty whole killed son sorry sorry thing lol leav,-0.0258,neu
"Mar 04, 2018","I just wish that all of the gods and goddesses would RESPECT hades because without hades all mortals would live forever (no death) & New lives such as babies or children wouldnt be born.   ""with death it makes way for new life"".",205,3,I just wish that all of the gods and goddesses would RESPECT hades because without hades all mortals would live forever no death New lives such as babies or children wouldnt be born with death it makes way for new life,i just wish that all of the gods and goddesses would respect hades because without hades all mortals would live forever no death new lives such as babies or children wouldnt be born with death it makes way for new life,"['i', 'just', 'wish', 'that', 'all', 'of', 'the', 'gods', 'and', 'goddesses', 'would', 'respect', 'hades', 'because', 'without', 'hades', 'all', 'mortals', 'would', 'live', 'forever', 'no', 'death', 'new', 'lives', 'such', 'as', 'babies', 'or', 'children', 'wouldnt', 'be', 'born', 'with', 'death', 'it', 'makes', 'way', 'for', 'new', 'life']",wish gods goddesses would respect hades without hades mortals would live forever death new lives babies children wouldnt born death makes way new life,wish gods goddesses would respect hades without hades mortals would live forever death new lives babies children wouldnt born death makes way new lif,0.6182,pos
"Mar 04, 2018",Wow Zeus is unsurprisingly a dick lol,179,0,Wow Zeus is unsurprisingly a dick lol,wow zeus is unsurprisingly a dick lol,"['wow', 'zeus', 'is', 'unsurprisingly', 'a', 'dick', 'lol']",wow zeus unsurprisingly dick lol,wow zeus unsurprisingly dick lol,0.5106,pos
"Mar 04, 2018","""Who is she? She's beautiful""  Me when I got my new dog",171,0,Who is she She s beautiful Me when I got my new dog,who is she she s beautiful me when i got my new dog,"['who', 'is', 'she', 'she', 's', 'beautiful', 'me', 'when', 'i', 'got', 'my', 'new', 'dog']",beautiful got new dog,beautiful got new dog,0.5994,pos
"Jul 23, 2018",Am I the only one who likes the dress she had on first better?,165,0,Am I the only one who likes the dress she had on first better,am i the only one who likes the dress she had on first better,"['am', 'i', 'the', 'only', 'one', 'who', 'likes', 'the', 'dress', 'she', 'had', 'on', 'first', 'better']",one likes dress first better,one likes dress first bett,0.4215,pos
"Mar 19, 2018",I am legitimately so happy that there's a Greek Mythology webtoon. My life is complete. I can die in peace.,120,0,I am legitimately so happy that there s a Greek Mythology webtoon My life is complete I can die in peace,i am legitimately so happy that there s a greek mythology webtoon my life is complete i can die in peace,"['i', 'am', 'legitimately', 'so', 'happy', 'that', 'there', 's', 'a', 'greek', 'mythology', 'webtoon', 'my', 'life', 'is', 'complete', 'i', 'can', 'die', 'in', 'peace']",legitimately happy greek mythology webtoon life complete die peace,legitimately happy greek mythology webtoon life complete die peac,-0.0516,neg
"Mar 04, 2018","Hades: Who is she? Me: (subconsciously) I don't know, but she did a very good job turning me gay.",122,3,Hades Who is she Me subconsciously I don t know but she did a very good job turning me gay,hades who is she me subconsciously i don t know but she did a very good job turning me gay,"['hades', 'who', 'is', 'she', 'me', 'subconsciously', 'i', 'don', 't', 'know', 'but', 'she', 'did', 'a', 'very', 'good', 'job', 'turning', 'me', 'gay']",hades subconsciously know good job turning gay,hades subconsciously know good job turning gay,0.4404,pos
"Mar 07, 2018","KEEP IT MOVING, ODYSSEUS! I KNOW WHAT YOU DID!",106,0,KEEP IT MOVING ODYSSEUS I KNOW WHAT YOU DID,keep it moving odysseus i know what you did,"['keep', 'it', 'moving', 'odysseus', 'i', 'know', 'what', 'you', 'did']",keep moving odysseus know,keep moving odysseus know,0.0,neu
"Mar 04, 2018",poor Odysseus this time he has no boat to sail away with,90,0,poor Odysseus this time he has no boat to sail away with,poor odysseus this time he has no boat to sail away with,"['poor', 'odysseus', 'this', 'time', 'he', 'has', 'no', 'boat', 'to', 'sail', 'away', 'with']",poor odysseus time boat sail away,poor odysseus time boat sail away,-0.4767,neg
"Sep 08, 2018",Zeus and Hades in their finest and Poseidon in... a t-shirt... wait... T-shirt. Man Bun. Beer. OMG he’s BROseidon!,88,0,Zeus and Hades in their finest and Poseidon in a t shirt wait T shirt Man Bun Beer OMG he’s BROseidon,zeus and hades in their finest and poseidon in a t shirt wait t shirt man bun beer omg he’s broseidon,"['zeus', 'and', 'hades', 'in', 'their', 'finest', 'and', 'poseidon', 'in', 'a', 't', 'shirt', 'wait', 't', 'shirt', 'man', 'bun', 'beer', 'omg', 'he', '’', 's', 'broseidon']",zeus hades finest poseidon shirt wait shirt man bun beer omg ’ broseidon,zeus hades finest poseidon shirt wait shirt man bun beer omg ’ broseidon,0.0,neu
"Mar 18, 2018",That dress is TINY-,88,0,That dress is TINY,that dress is tiny,"['that', 'dress', 'is', 'tiny']",dress tiny,dress tini,0.0,neu
"Mar 04, 2018",When you know know someone talking sh*t about you although you are on the other side of the room.,107498,256,When you know know someone talking sh t about you although you are on the other side of the room,when you know know someone talking sh t about you although you are on the other side of the room,"['when', 'you', 'know', 'know', 'someone', 'talking', 'sh', 't', 'about', 'you', 'although', 'you', 'are', 'on', 'the', 'other', 'side', 'of', 'the', 'room']",know know someone talking sh although side room,know know someone talking sh although side room,0.0,neu
